module	monet_type	experiment_info	function_summary	term_id_REAC	term_id_KEGG	term_id_GO_BP	goslim_pir	genes_orig	genes_hugo	genes_descriptions
1	R1	e019_R1	The activation of arylsulfatases	REAC:R-HSA-1663150	NA	NA	NA	ENSG00000129103;ENSG00000106392;ENSG00000185615;ENSG00000079150;ENSG00000120942;ENSG00000167123;ENSG00000079459;ENSG00000171861;ENSG00000117862;ENSG00000065057;ENSG00000149380;ENSG00000023318;ENSG00000131730;ENSG00000162433;ENSG00000001630;ENSG00000141337;ENSG00000144455	SUMF2;C1GALT1;PDIA2;FKBP7;UBIAD1;CERCAM;FDFT1;MRM3;TXNDC12;NTHL1;P4HA3;ERP44;CKMT2;AK4;CYP51A1;ARSG;SUMF1	sulfatase modifying factor 2 [Source:HGNC Symbol;Acc:HGNC:20415] ~ core 1 synthase, glycoprotein-N-acetylgalactosamine 3-beta-galactosyltransferase 1 [Source:HGNC Symbol;Acc:HGNC:24337] ~ protein disulfide isomerase family A member 2 [Source:HGNC Symbol;Acc:HGNC:14180] ~ FKBP prolyl isomerase 7 [Source:HGNC Symbol;Acc:HGNC:3723] ~ UbiA prenyltransferase domain containing 1 [Source:HGNC Symbol;Acc:HGNC:30791] ~ cerebral endothelial cell adhesion molecule [Source:HGNC Symbol;Acc:HGNC:23723] ~ farnesyl-diphosphate farnesyltransferase 1 [Source:HGNC Symbol;Acc:HGNC:3629] ~ mitochondrial rRNA methyltransferase 3 [Source:HGNC Symbol;Acc:HGNC:18485] ~ thioredoxin domain containing 12 [Source:HGNC Symbol;Acc:HGNC:24626] ~ nth like DNA glycosylase 1 [Source:HGNC Symbol;Acc:HGNC:8028] ~ prolyl 4-hydroxylase subunit alpha 3 [Source:HGNC Symbol;Acc:HGNC:30135] ~ endoplasmic reticulum protein 44 [Source:HGNC Symbol;Acc:HGNC:18311] ~ creatine kinase, mitochondrial 2 [Source:HGNC Symbol;Acc:HGNC:1996] ~ adenylate kinase 4 [Source:HGNC Symbol;Acc:HGNC:363] ~ cytochrome P450 family 51 subfamily A member 1 [Source:HGNC Symbol;Acc:HGNC:2649] ~ arylsulfatase G [Source:HGNC Symbol;Acc:HGNC:24102] ~ sulfatase modifying factor 1 [Source:HGNC Symbol;Acc:HGNC:20376]
2	R1	e019_R1	Glycosaminoglycan degradation / Mucopolysaccharidoses	REAC:R-HSA-2206281	KEGG:00531	NA	GO:0008152	ENSG00000144935;ENSG00000143387;ENSG00000107779;ENSG00000135047;ENSG00000100299;ENSG00000112149;ENSG00000010404;ENSG00000103811;ENSG00000138741;ENSG00000116031;ENSG00000170373;ENSG00000175938;ENSG00000110013;ENSG00000157869;ENSG00000136943;ENSG00000198742;ENSG00000133107;ENSG00000101441;ENSG00000109861;ENSG00000072315;ENSG00000169919;ENSG00000221983;ENSG00000204217;ENSG00000141012;ENSG00000108784;ENSG00000138744;ENSG00000181523;ENSG00000137976;ENSG00000109323;ENSG00000276045;ENSG00000168878;ENSG00000174136	TRPC1;CTSK;BMPR1A;CTSL;ARSA;CD83;IDS;CTSH;TRPC3;CD207;CST1;ORAI3;SIAE;RAB28;CTSV;SMURF1;TRPC4;CST4;CTSC;TRPC5;GUSB;UBA52;BMPR2;GALNS;NAGLU;NAAA;SGSH;DNASE2B;MANBA;ORAI1;SFTPB;RGMB	transient receptor potential cation channel subfamily C member 1 [Source:HGNC Symbol;Acc:HGNC:12333] ~ cathepsin K [Source:HGNC Symbol;Acc:HGNC:2536] ~ bone morphogenetic protein receptor type 1A [Source:HGNC Symbol;Acc:HGNC:1076] ~ cathepsin L [Source:HGNC Symbol;Acc:HGNC:2537] ~ arylsulfatase A [Source:HGNC Symbol;Acc:HGNC:713] ~ CD83 molecule [Source:HGNC Symbol;Acc:HGNC:1703] ~ iduronate 2-sulfatase [Source:HGNC Symbol;Acc:HGNC:5389] ~ cathepsin H [Source:HGNC Symbol;Acc:HGNC:2535] ~ transient receptor potential cation channel subfamily C member 3 [Source:HGNC Symbol;Acc:HGNC:12335] ~ CD207 molecule [Source:HGNC Symbol;Acc:HGNC:17935] ~ cystatin SN [Source:HGNC Symbol;Acc:HGNC:2473] ~ ORAI calcium release-activated calcium modulator 3 [Source:HGNC Symbol;Acc:HGNC:28185] ~ sialic acid acetylesterase [Source:HGNC Symbol;Acc:HGNC:18187] ~ RAB28, member RAS oncogene family [Source:HGNC Symbol;Acc:HGNC:9768] ~ cathepsin V [Source:HGNC Symbol;Acc:HGNC:2538] ~ SMAD specific E3 ubiquitin protein ligase 1 [Source:HGNC Symbol;Acc:HGNC:16807] ~ transient receptor potential cation channel subfamily C member 4 [Source:HGNC Symbol;Acc:HGNC:12336] ~ cystatin S [Source:HGNC Symbol;Acc:HGNC:2476] ~ cathepsin C [Source:HGNC Symbol;Acc:HGNC:2528] ~ transient receptor potential cation channel subfamily C member 5 [Source:HGNC Symbol;Acc:HGNC:12337] ~ glucuronidase beta [Source:HGNC Symbol;Acc:HGNC:4696] ~ ubiquitin A-52 residue ribosomal protein fusion product 1 [Source:HGNC Symbol;Acc:HGNC:12458] ~ bone morphogenetic protein receptor type 2 [Source:HGNC Symbol;Acc:HGNC:1078] ~ galactosamine (N-acetyl)-6-sulfatase [Source:HGNC Symbol;Acc:HGNC:4122] ~ N-acetyl-alpha-glucosaminidase [Source:HGNC Symbol;Acc:HGNC:7632] ~ N-acylethanolamine acid amidase [Source:HGNC Symbol;Acc:HGNC:736] ~ N-sulfoglucosamine sulfohydrolase [Source:HGNC Symbol;Acc:HGNC:10818] ~ deoxyribonuclease 2 beta [Source:HGNC Symbol;Acc:HGNC:28875] ~ mannosidase beta [Source:HGNC Symbol;Acc:HGNC:6831] ~ ORAI calcium release-activated calcium modulator 1 [Source:HGNC Symbol;Acc:HGNC:25896] ~ surfactant protein B [Source:HGNC Symbol;Acc:HGNC:10801] ~ repulsive guidance molecule BMP co-receptor b [Source:HGNC Symbol;Acc:HGNC:26896]
3	R1	e019_R1	Prostanoid ligand receptors	REAC:R-HSA-391908	NA	NA	GO:0050789	ENSG00000058668;ENSG00000136802;ENSG00000107317;ENSG00000125398;ENSG00000121989;ENSG00000037280;ENSG00000144891;ENSG00000167601;ENSG00000092445;ENSG00000101558;ENSG00000050628;ENSG00000122420;ENSG00000214160;ENSG00000147804;ENSG00000075673;ENSG00000167889;ENSG00000125384;ENSG00000042445;ENSG00000160951;ENSG00000076351;ENSG00000182621;ENSG00000150630	ATP2B4;LRRC8A;PTGDS;SOX9;ACVR2A;FLT4;AGTR1;AXL;TYRO3;VAPA;PTGER3;PTGFR;ALG3;SLC39A4;ATP12A;MGAT5B;PTGER2;RETSAT;PTGER1;SLC46A1;PLCB1;VEGFC	ATPase plasma membrane Ca2+ transporting 4 [Source:HGNC Symbol;Acc:HGNC:817] ~ leucine rich repeat containing 8 VRAC subunit A [Source:HGNC Symbol;Acc:HGNC:19027] ~ prostaglandin D2 synthase [Source:HGNC Symbol;Acc:HGNC:9592] ~ SRY-box transcription factor 9 [Source:HGNC Symbol;Acc:HGNC:11204] ~ activin A receptor type 2A [Source:HGNC Symbol;Acc:HGNC:173] ~ fms related receptor tyrosine kinase 4 [Source:HGNC Symbol;Acc:HGNC:3767] ~ angiotensin II receptor type 1 [Source:HGNC Symbol;Acc:HGNC:336] ~ AXL receptor tyrosine kinase [Source:HGNC Symbol;Acc:HGNC:905] ~ TYRO3 protein tyrosine kinase [Source:HGNC Symbol;Acc:HGNC:12446] ~ VAMP associated protein A [Source:HGNC Symbol;Acc:HGNC:12648] ~ prostaglandin E receptor 3 [Source:HGNC Symbol;Acc:HGNC:9595] ~ prostaglandin F receptor [Source:HGNC Symbol;Acc:HGNC:9600] ~ ALG3 alpha-1,3- mannosyltransferase [Source:HGNC Symbol;Acc:HGNC:23056] ~ solute carrier family 39 member 4 [Source:HGNC Symbol;Acc:HGNC:17129] ~ ATPase H+/K+ transporting non-gastric alpha2 subunit [Source:HGNC Symbol;Acc:HGNC:13816] ~ alpha-1,6-mannosylglycoprotein 6-beta-N-acetylglucosaminyltransferase B [Source:HGNC Symbol;Acc:HGNC:24140] ~ prostaglandin E receptor 2 [Source:HGNC Symbol;Acc:HGNC:9594] ~ retinol saturase [Source:HGNC Symbol;Acc:HGNC:25991] ~ prostaglandin E receptor 1 [Source:HGNC Symbol;Acc:HGNC:9593] ~ solute carrier family 46 member 1 [Source:HGNC Symbol;Acc:HGNC:30521] ~ phospholipase C beta 1 [Source:HGNC Symbol;Acc:HGNC:15917] ~ vascular endothelial growth factor C [Source:HGNC Symbol;Acc:HGNC:12682]
4	R1	e019_R1	potassium ion import across plasma membrane / Inwardly rectifying K+ channels	REAC:R-HSA-1296065	NA	GO:1990573	GO:0006936;GO:0006811	ENSG00000069431;ENSG00000149311;ENSG00000008196;ENSG00000087510;ENSG00000153822;ENSG00000115641;ENSG00000137203;ENSG00000215375;ENSG00000159176;ENSG00000133026;ENSG00000111245;ENSG00000121361;ENSG00000123700;ENSG00000068796;ENSG00000134318;ENSG00000084112;ENSG00000103671;ENSG00000092054;ENSG00000160808;ENSG00000103460;ENSG00000177807;ENSG00000006071;ENSG00000124275;ENSG00000187486;ENSG00000157551	ABCC9;ATM;TFAP2B;TFAP2C;KCNJ16;FHL2;TFAP2A;MYL5;CSRP1;MYH10;MYL2;KCNJ8;KCNJ2;KIF2A;ROCK2;SSH1;TRIP4;MYH7;MYL3;TOX3;KCNJ10;ABCC8;MTRR;KCNJ11;KCNJ15	ATP binding cassette subfamily C member 9 [Source:HGNC Symbol;Acc:HGNC:60] ~ ATM serine/threonine kinase [Source:HGNC Symbol;Acc:HGNC:795] ~ transcription factor AP-2 beta [Source:HGNC Symbol;Acc:HGNC:11743] ~ transcription factor AP-2 gamma [Source:HGNC Symbol;Acc:HGNC:11744] ~ potassium inwardly rectifying channel subfamily J member 16 [Source:HGNC Symbol;Acc:HGNC:6262] ~ four and a half LIM domains 2 [Source:HGNC Symbol;Acc:HGNC:3703] ~ transcription factor AP-2 alpha [Source:HGNC Symbol;Acc:HGNC:11742] ~ myosin light chain 5 [Source:HGNC Symbol;Acc:HGNC:7586] ~ cysteine and glycine rich protein 1 [Source:HGNC Symbol;Acc:HGNC:2469] ~ myosin heavy chain 10 [Source:HGNC Symbol;Acc:HGNC:7568] ~ myosin light chain 2 [Source:HGNC Symbol;Acc:HGNC:7583] ~ potassium inwardly rectifying channel subfamily J member 8 [Source:HGNC Symbol;Acc:HGNC:6269] ~ potassium inwardly rectifying channel subfamily J member 2 [Source:HGNC Symbol;Acc:HGNC:6263] ~ kinesin family member 2A [Source:HGNC Symbol;Acc:HGNC:6318] ~ Rho associated coiled-coil containing protein kinase 2 [Source:HGNC Symbol;Acc:HGNC:10252] ~ slingshot protein phosphatase 1 [Source:HGNC Symbol;Acc:HGNC:30579] ~ thyroid hormone receptor interactor 4 [Source:HGNC Symbol;Acc:HGNC:12310] ~ myosin heavy chain 7 [Source:HGNC Symbol;Acc:HGNC:7577] ~ myosin light chain 3 [Source:HGNC Symbol;Acc:HGNC:7584] ~ TOX high mobility group box family member 3 [Source:HGNC Symbol;Acc:HGNC:11972] ~ potassium inwardly rectifying channel subfamily J member 10 [Source:HGNC Symbol;Acc:HGNC:6256] ~ ATP binding cassette subfamily C member 8 [Source:HGNC Symbol;Acc:HGNC:59] ~ 5-methyltetrahydrofolate-homocysteine methyltransferase reductase [Source:HGNC Symbol;Acc:HGNC:7473] ~ potassium inwardly rectifying channel subfamily J member 11 [Source:HGNC Symbol;Acc:HGNC:6257] ~ potassium inwardly rectifying channel subfamily J member 15 [Source:HGNC Symbol;Acc:HGNC:6261]
5	R1	e019_R1	proton motive force-driven mitochondrial ATP synthesis / Thermogenesis / Formation of ATP by chemiosmotic coupling	REAC:R-HSA-163210	KEGG:04714	GO:0042776	GO:0006119;GO:0009117	ENSG00000084754;ENSG00000105971;ENSG00000116459;ENSG00000128596;ENSG00000099624;ENSG00000167283;ENSG00000115353;ENSG00000167863;ENSG00000165629;ENSG00000100335;ENSG00000124172;ENSG00000081791;ENSG00000110955;ENSG00000169020;ENSG00000110536;ENSG00000241837;ENSG00000154723;ENSG00000241468;ENSG00000178537;ENSG00000123130;ENSG00000157184;ENSG00000008311;ENSG00000155008;ENSG00000101247;ENSG00000143653;ENSG00000131459;ENSG00000169313;ENSG00000224877	HADHA;CAV2;ATP5PB;CCDC136;ATP5F1D;ATP5MG;TACR1;ATP5PD;ATP5F1C;MIEF1;ATP5F1E;DELE1;ATP5F1B;ATP5ME;PTPMT1;ATP5PO;ATP5PF;ATP5MF;SLC25A20;ACOT9;CPT2;AASS;APOOL;NDUFAF5;SCCPDH;GFPT2;P2RY12;NDUFAF8	hydroxyacyl-CoA dehydrogenase trifunctional multienzyme complex subunit alpha [Source:HGNC Symbol;Acc:HGNC:4801] ~ caveolin 2 [Source:HGNC Symbol;Acc:HGNC:1528] ~ ATP synthase peripheral stalk-membrane subunit b [Source:HGNC Symbol;Acc:HGNC:840] ~ coiled-coil domain containing 136 [Source:HGNC Symbol;Acc:HGNC:22225] ~ ATP synthase F1 subunit delta [Source:HGNC Symbol;Acc:HGNC:837] ~ ATP synthase membrane subunit g [Source:HGNC Symbol;Acc:HGNC:14247] ~ tachykinin receptor 1 [Source:HGNC Symbol;Acc:HGNC:11526] ~ ATP synthase peripheral stalk subunit d [Source:HGNC Symbol;Acc:HGNC:845] ~ ATP synthase F1 subunit gamma [Source:HGNC Symbol;Acc:HGNC:833] ~ mitochondrial elongation factor 1 [Source:HGNC Symbol;Acc:HGNC:25979] ~ ATP synthase F1 subunit epsilon [Source:HGNC Symbol;Acc:HGNC:838] ~ DAP3 binding cell death enhancer 1 [Source:HGNC Symbol;Acc:HGNC:28969] ~ ATP synthase F1 subunit beta [Source:HGNC Symbol;Acc:HGNC:830] ~ ATP synthase membrane subunit e [Source:HGNC Symbol;Acc:HGNC:846] ~ protein tyrosine phosphatase mitochondrial 1 [Source:HGNC Symbol;Acc:HGNC:26965] ~ ATP synthase peripheral stalk subunit OSCP [Source:HGNC Symbol;Acc:HGNC:850] ~ ATP synthase peripheral stalk subunit F6 [Source:HGNC Symbol;Acc:HGNC:847] ~ ATP synthase membrane subunit f [Source:HGNC Symbol;Acc:HGNC:848] ~ solute carrier family 25 member 20 [Source:HGNC Symbol;Acc:HGNC:1421] ~ acyl-CoA thioesterase 9 [Source:HGNC Symbol;Acc:HGNC:17152] ~ carnitine palmitoyltransferase 2 [Source:HGNC Symbol;Acc:HGNC:2330] ~ aminoadipate-semialdehyde synthase [Source:HGNC Symbol;Acc:HGNC:17366] ~ apolipoprotein O like [Source:HGNC Symbol;Acc:HGNC:24009] ~ NADH:ubiquinone oxidoreductase complex assembly factor 5 [Source:HGNC Symbol;Acc:HGNC:15899] ~ saccharopine dehydrogenase (putative) [Source:HGNC Symbol;Acc:HGNC:24275] ~ glutamine-fructose-6-phosphate transaminase 2 [Source:HGNC Symbol;Acc:HGNC:4242] ~ purinergic receptor P2Y12 [Source:HGNC Symbol;Acc:HGNC:18124] ~ NADH:ubiquinone oxidoreductase complex assembly factor 8 [Source:HGNC Symbol;Acc:HGNC:33551]
6	R1	e019_R1	Basal transcription factors / RNA Polymerase II Transcription Pre-Initiation And Promoter Opening	REAC:R-HSA-73779	KEGG:03022	NA	GO:0009059;GO:0006281;GO:0016070	ENSG00000153767;ENSG00000125651;ENSG00000002016;ENSG00000134058;ENSG00000078725;ENSG00000110768;ENSG00000134480;ENSG00000104884;ENSG00000137947;ENSG00000134899;ENSG00000049167;ENSG00000163161;ENSG00000108010;ENSG00000188342;ENSG00000155229;ENSG00000020426;ENSG00000144021;ENSG00000168386;ENSG00000154767;ENSG00000090615;ENSG00000171681;ENSG00000090889;ENSG00000111358;ENSG00000272047;ENSG00000225830;ENSG00000197265;ENSG00000174177	GTF2E1;GTF2F1;RAD52;CDK7;BRINP1;GTF2H1;CCNH;ERCC2;GTF2B;ERCC5;ERCC8;ERCC3;GLRX3;GTF2F2;MMS19;MNAT1;CIAO1;FILIP1L;XPC;GOLGA3;ATF7IP;KIF4A;GTF2H3;GTF2H5;ERCC6;GTF2E2;CTU2	general transcription factor IIE subunit 1 [Source:HGNC Symbol;Acc:HGNC:4650] ~ general transcription factor IIF subunit 1 [Source:HGNC Symbol;Acc:HGNC:4652] ~ RAD52 homolog, DNA repair protein [Source:HGNC Symbol;Acc:HGNC:9824] ~ cyclin dependent kinase 7 [Source:HGNC Symbol;Acc:HGNC:1778] ~ BMP/retinoic acid inducible neural specific 1 [Source:HGNC Symbol;Acc:HGNC:2687] ~ general transcription factor IIH subunit 1 [Source:HGNC Symbol;Acc:HGNC:4655] ~ cyclin H [Source:HGNC Symbol;Acc:HGNC:1594] ~ ERCC excision repair 2, TFIIH core complex helicase subunit [Source:HGNC Symbol;Acc:HGNC:3434] ~ general transcription factor IIB [Source:HGNC Symbol;Acc:HGNC:4648] ~ ERCC excision repair 5, endonuclease [Source:HGNC Symbol;Acc:HGNC:3437] ~ ERCC excision repair 8, CSA ubiquitin ligase complex subunit [Source:HGNC Symbol;Acc:HGNC:3439] ~ ERCC excision repair 3, TFIIH core complex helicase subunit [Source:HGNC Symbol;Acc:HGNC:3435] ~ glutaredoxin 3 [Source:HGNC Symbol;Acc:HGNC:15987] ~ general transcription factor IIF subunit 2 [Source:HGNC Symbol;Acc:HGNC:4653] ~ MMS19 homolog, cytosolic iron-sulfur assembly component [Source:HGNC Symbol;Acc:HGNC:13824] ~ MNAT1 component of CDK activating kinase [Source:HGNC Symbol;Acc:HGNC:7181] ~ cytosolic iron-sulfur assembly component 1 [Source:HGNC Symbol;Acc:HGNC:14280] ~ filamin A interacting protein 1 like [Source:HGNC Symbol;Acc:HGNC:24589] ~ XPC complex subunit, DNA damage recognition and repair factor [Source:HGNC Symbol;Acc:HGNC:12816] ~ golgin A3 [Source:HGNC Symbol;Acc:HGNC:4426] ~ activating transcription factor 7 interacting protein [Source:HGNC Symbol;Acc:HGNC:20092] ~ kinesin family member 4A [Source:HGNC Symbol;Acc:HGNC:13339] ~ general transcription factor IIH subunit 3 [Source:HGNC Symbol;Acc:HGNC:4657] ~ general transcription factor IIH subunit 5 [Source:HGNC Symbol;Acc:HGNC:21157] ~ ERCC excision repair 6, chromatin remodeling factor [Source:HGNC Symbol;Acc:HGNC:3438] ~ general transcription factor IIE subunit 2 [Source:HGNC Symbol;Acc:HGNC:4651] ~ cytosolic thiouridylase subunit 2 [Source:HGNC Symbol;Acc:HGNC:28005]
7	R1	e019_R1	monoubiquitinated histone deubiquitination / Basal transcription factors / RNA Polymerase II HIV Promoter Escape	REAC:R-HSA-167162	KEGG:03022	GO:0035521	GO:0006508;GO:0016070;GO:0050789;GO:0065003;GO:0036211;GO:0009059	ENSG00000140307;ENSG00000152284;ENSG00000112592;ENSG00000028839;ENSG00000107223;ENSG00000124422;ENSG00000120656;ENSG00000165417;ENSG00000132274;ENSG00000162227;ENSG00000102710;ENSG00000147133;ENSG00000130699;ENSG00000113387;ENSG00000137413;ENSG00000149179;ENSG00000087152;ENSG00000064313;ENSG00000165632;ENSG00000173011;ENSG00000106290;ENSG00000064995;ENSG00000120533;ENSG00000148835;ENSG00000102387;ENSG00000163132;ENSG00000122299;ENSG00000135801;ENSG00000178913;ENSG00000166337;ENSG00000119760;ENSG00000152382;ENSG00000197780;ENSG00000141384;ENSG00000196284;ENSG00000187325;ENSG00000164442;ENSG00000242441;ENSG00000182521	GTF2A2;TCF7L1;TBP;TBPL1;EDF1;USP22;TAF12;GTF2A1;TRIM22;TAF6L;SUPT20H;TAF1;TAF4;SUB1;TAF8;CSTPP1;ATXN7L3;TAF2;TAF3;TADA2B;TAF6;TAF11;ENY2;TAF5;TAF7L;MSX1;ZC3H7A;TAF5L;TAF7;TAF10;SUPT7L;TADA1;TAF13;TAF4B;SUPT3H;TAF9B;CITED2;GTF2A1L;TBPL2	general transcription factor IIA subunit 2 [Source:HGNC Symbol;Acc:HGNC:4647] ~ transcription factor 7 like 1 [Source:HGNC Symbol;Acc:HGNC:11640] ~ TATA-box binding protein [Source:HGNC Symbol;Acc:HGNC:11588] ~ TATA-box binding protein like 1 [Source:HGNC Symbol;Acc:HGNC:11589] ~ endothelial differentiation related factor 1 [Source:HGNC Symbol;Acc:HGNC:3164] ~ ubiquitin specific peptidase 22 [Source:HGNC Symbol;Acc:HGNC:12621] ~ TATA-box binding protein associated factor 12 [Source:HGNC Symbol;Acc:HGNC:11545] ~ general transcription factor IIA subunit 1 [Source:HGNC Symbol;Acc:HGNC:4646] ~ tripartite motif containing 22 [Source:HGNC Symbol;Acc:HGNC:16379] ~ TATA-box binding protein associated factor 6 like [Source:HGNC Symbol;Acc:HGNC:17305] ~ SPT20 homolog, SAGA complex component [Source:HGNC Symbol;Acc:HGNC:20596] ~ TATA-box binding protein associated factor 1 [Source:HGNC Symbol;Acc:HGNC:11535] ~ TATA-box binding protein associated factor 4 [Source:HGNC Symbol;Acc:HGNC:11537] ~ SUB1 regulator of transcription [Source:HGNC Symbol;Acc:HGNC:19985] ~ TATA-box binding protein associated factor 8 [Source:HGNC Symbol;Acc:HGNC:17300] ~ centriolar satellite-associated tubulin polyglutamylase complex regulator 1 [Source:HGNC Symbol;Acc:HGNC:28720] ~ ataxin 7 like 3 [Source:HGNC Symbol;Acc:HGNC:25416] ~ TATA-box binding protein associated factor 2 [Source:HGNC Symbol;Acc:HGNC:11536] ~ TATA-box binding protein associated factor 3 [Source:HGNC Symbol;Acc:HGNC:17303] ~ transcriptional adaptor 2B [Source:HGNC Symbol;Acc:HGNC:30781] ~ TATA-box binding protein associated factor 6 [Source:HGNC Symbol;Acc:HGNC:11540] ~ TATA-box binding protein associated factor 11 [Source:HGNC Symbol;Acc:HGNC:11544] ~ ENY2 transcription and export complex 2 subunit [Source:HGNC Symbol;Acc:HGNC:24449] ~ TATA-box binding protein associated factor 5 [Source:HGNC Symbol;Acc:HGNC:11539] ~ TATA-box binding protein associated factor 7 like [Source:HGNC Symbol;Acc:HGNC:11548] ~ msh homeobox 1 [Source:HGNC Symbol;Acc:HGNC:7391] ~ zinc finger CCCH-type containing 7A [Source:HGNC Symbol;Acc:HGNC:30959] ~ TATA-box binding protein associated factor 5 like [Source:HGNC Symbol;Acc:HGNC:17304] ~ TATA-box binding protein associated factor 7 [Source:HGNC Symbol;Acc:HGNC:11541] ~ TATA-box binding protein associated factor 10 [Source:HGNC Symbol;Acc:HGNC:11543] ~ SPT7 like, STAGA complex subunit gamma [Source:HGNC Symbol;Acc:HGNC:30632] ~ transcriptional adaptor 1 [Source:HGNC Symbol;Acc:HGNC:30631] ~ TATA-box binding protein associated factor 13 [Source:HGNC Symbol;Acc:HGNC:11546] ~ TATA-box binding protein associated factor 4b [Source:HGNC Symbol;Acc:HGNC:11538] ~ SPT3 homolog, SAGA and STAGA complex component [Source:HGNC Symbol;Acc:HGNC:11466] ~ TATA-box binding protein associated factor 9b [Source:HGNC Symbol;Acc:HGNC:17306] ~ Cbp/p300 interacting transactivator with Glu/Asp rich carboxy-terminal domain 2 [Source:HGNC Symbol;Acc:HGNC:1987] ~ general transcription factor IIA subunit 1 like [Source:HGNC Symbol;Acc:HGNC:30727] ~ TATA-box binding protein like 2 [Source:HGNC Symbol;Acc:HGNC:19841]
8	R1	e019_R1	RHO GTPase cycle	REAC:R-HSA-9012999	NA	NA	NA	ENSG00000162738;ENSG00000039068;ENSG00000002586;ENSG00000107863;ENSG00000165731;ENSG00000117155;ENSG00000144283;ENSG00000150054;ENSG00000149177;ENSG00000081026;ENSG00000147394;ENSG00000119888;ENSG00000151239;ENSG00000101311;ENSG00000173517;ENSG00000197965;ENSG00000205476;ENSG00000115459	VANGL2;CDH1;CD99;ARHGAP21;RET;SSX2IP;PKP4;MPP7;PTPRJ;MAGI3;ZNF185;EPCAM;TWF1;FERMT1;PEAK1;MPZL1;CCDC85C;ELMOD3	VANGL planar cell polarity protein 2 [Source:HGNC Symbol;Acc:HGNC:15511] ~ cadherin 1 [Source:HGNC Symbol;Acc:HGNC:1748] ~ CD99 molecule (Xg blood group) [Source:HGNC Symbol;Acc:HGNC:7082] ~ Rho GTPase activating protein 21 [Source:HGNC Symbol;Acc:HGNC:23725] ~ ret proto-oncogene [Source:HGNC Symbol;Acc:HGNC:9967] ~ SSX family member 2 interacting protein [Source:HGNC Symbol;Acc:HGNC:16509] ~ plakophilin 4 [Source:HGNC Symbol;Acc:HGNC:9026] ~ MAGUK p55 scaffold protein 7 [Source:HGNC Symbol;Acc:HGNC:26542] ~ protein tyrosine phosphatase receptor type J [Source:HGNC Symbol;Acc:HGNC:9673] ~ membrane associated guanylate kinase, WW and PDZ domain containing 3 [Source:HGNC Symbol;Acc:HGNC:29647] ~ zinc finger protein 185 with LIM domain [Source:HGNC Symbol;Acc:HGNC:12976] ~ epithelial cell adhesion molecule [Source:HGNC Symbol;Acc:HGNC:11529] ~ twinfilin actin binding protein 1 [Source:HGNC Symbol;Acc:HGNC:9620] ~ FERM domain containing kindlin 1 [Source:HGNC Symbol;Acc:HGNC:15889] ~ pseudopodium enriched atypical kinase 1 [Source:HGNC Symbol;Acc:HGNC:29431] ~ myelin protein zero like 1 [Source:HGNC Symbol;Acc:HGNC:7226] ~ coiled-coil domain containing 85C [Source:HGNC Symbol;Acc:HGNC:35459] ~ ELMO domain containing 3 [Source:HGNC Symbol;Acc:HGNC:26158]
9	R1	e019_R1	hydrogen peroxide catabolic process	NA	NA	GO:0042744	GO:0008152;GO:0015669	ENSG00000004975;ENSG00000206172;ENSG00000084207;ENSG00000127191;ENSG00000114354;ENSG00000136848;ENSG00000130656;ENSG00000164949;ENSG00000108039;ENSG00000196565;ENSG00000161202;ENSG00000086506;ENSG00000257017;ENSG00000206177;ENSG00000244734;ENSG00000223609;ENSG00000213931	DVL2;HBA1;GSTP1;TRAF2;TFG;DAB2IP;HBZ;GEM;XPNPEP1;HBG2;DVL3;HBQ1;HP;HBM;HBB;HBD;HBE1	dishevelled segment polarity protein 2 [Source:HGNC Symbol;Acc:HGNC:3086] ~ hemoglobin subunit alpha 1 [Source:HGNC Symbol;Acc:HGNC:4823] ~ glutathione S-transferase pi 1 [Source:HGNC Symbol;Acc:HGNC:4638] ~ TNF receptor associated factor 2 [Source:HGNC Symbol;Acc:HGNC:12032] ~ trafficking from ER to golgi regulator [Source:HGNC Symbol;Acc:HGNC:11758] ~ DAB2 interacting protein [Source:HGNC Symbol;Acc:HGNC:17294] ~ hemoglobin subunit zeta [Source:HGNC Symbol;Acc:HGNC:4835] ~ GTP binding protein overexpressed in skeletal muscle [Source:HGNC Symbol;Acc:HGNC:4234] ~ X-prolyl aminopeptidase 1 [Source:HGNC Symbol;Acc:HGNC:12822] ~ hemoglobin subunit gamma 2 [Source:HGNC Symbol;Acc:HGNC:4832] ~ dishevelled segment polarity protein 3 [Source:HGNC Symbol;Acc:HGNC:3087] ~ hemoglobin subunit theta 1 [Source:HGNC Symbol;Acc:HGNC:4833] ~ haptoglobin [Source:HGNC Symbol;Acc:HGNC:5141] ~ hemoglobin subunit mu [Source:HGNC Symbol;Acc:HGNC:4826] ~ hemoglobin subunit beta [Source:HGNC Symbol;Acc:HGNC:4827] ~ hemoglobin subunit delta [Source:HGNC Symbol;Acc:HGNC:4829] ~ hemoglobin subunit epsilon 1 [Source:HGNC Symbol;Acc:HGNC:4830]
10	R1	e019_R1	canonical Wnt signaling pathway / Basal cell carcinoma / WNT ligand biogenesis and trafficking	REAC:R-HSA-3238698	KEGG:05217	GO:0060070	GO:0032501;GO:0007154;GO:0050896;GO:0050789;GO:0032502	ENSG00000114251;ENSG00000130164;ENSG00000070018;ENSG00000154342;ENSG00000125084;ENSG00000105989;ENSG00000104332;ENSG00000154764;ENSG00000157240;ENSG00000174804;ENSG00000180957;ENSG00000085741;ENSG00000169174;ENSG00000139684;ENSG00000156076;ENSG00000139610;ENSG00000145423;ENSG00000162552;ENSG00000198670;ENSG00000002745;ENSG00000111186;ENSG00000120057;ENSG00000188064;ENSG00000185269	WNT5A;LDLR;LRP6;WNT3A;WNT1;WNT2;SFRP1;WNT7A;FZD1;FZD4;PITPNB;WNT11;PCSK9;ESD;WIF1;CELA1;SFRP2;WNT4;LPA;WNT16;WNT5B;SFRP5;WNT7B;NOTUM	Wnt family member 5A [Source:HGNC Symbol;Acc:HGNC:12784] ~ low density lipoprotein receptor [Source:HGNC Symbol;Acc:HGNC:6547] ~ LDL receptor related protein 6 [Source:HGNC Symbol;Acc:HGNC:6698] ~ Wnt family member 3A [Source:HGNC Symbol;Acc:HGNC:15983] ~ Wnt family member 1 [Source:HGNC Symbol;Acc:HGNC:12774] ~ Wnt family member 2 [Source:HGNC Symbol;Acc:HGNC:12780] ~ secreted frizzled related protein 1 [Source:HGNC Symbol;Acc:HGNC:10776] ~ Wnt family member 7A [Source:HGNC Symbol;Acc:HGNC:12786] ~ frizzled class receptor 1 [Source:HGNC Symbol;Acc:HGNC:4038] ~ frizzled class receptor 4 [Source:HGNC Symbol;Acc:HGNC:4042] ~ phosphatidylinositol transfer protein beta [Source:HGNC Symbol;Acc:HGNC:9002] ~ Wnt family member 11 [Source:HGNC Symbol;Acc:HGNC:12776] ~ proprotein convertase subtilisin/kexin type 9 [Source:HGNC Symbol;Acc:HGNC:20001] ~ esterase D [Source:HGNC Symbol;Acc:HGNC:3465] ~ WNT inhibitory factor 1 [Source:HGNC Symbol;Acc:HGNC:18081] ~ chymotrypsin like elastase 1 [Source:HGNC Symbol;Acc:HGNC:3308] ~ secreted frizzled related protein 2 [Source:HGNC Symbol;Acc:HGNC:10777] ~ Wnt family member 4 [Source:HGNC Symbol;Acc:HGNC:12783] ~ lipoprotein(a) [Source:HGNC Symbol;Acc:HGNC:6667] ~ Wnt family member 16 [Source:HGNC Symbol;Acc:HGNC:16267] ~ Wnt family member 5B [Source:HGNC Symbol;Acc:HGNC:16265] ~ secreted frizzled related protein 5 [Source:HGNC Symbol;Acc:HGNC:10779] ~ Wnt family member 7B [Source:HGNC Symbol;Acc:HGNC:12787] ~ notum, palmitoleoyl-protein carboxylesterase [Source:HGNC Symbol;Acc:HGNC:27106]
