module	monet_type	experiment_info	function_summary	term_id_GO_BP	term_id_KEGG	term_id_REAC	goslim_pir	genes_orig	genes_hugo	genes_descriptions
139	R1	e019_R1	DNA synthesis involved in DNA repair / DNA replication / Translesion synthesis by Y family DNA polymerases bypasses lesions on DNA template	GO:0000731	KEGG:03030	REAC:R-HSA-110313	GO:0009059;GO:0006260;GO:0006281	ENSP00000216367;ENSP00000220913;ENSP00000223129;ENSP00000235310;ENSP00000241436;ENSP00000258428;ENSP00000263274;ENSP00000263681;ENSP00000264159;ENSP00000265465;ENSP00000268124;ENSP00000276893;ENSP00000300035;ENSP00000307143;ENSP00000311368;ENSP00000321239;ENSP00000322570;ENSP00000351697;ENSP00000355471;ENSP00000361310;ENSP00000362131;ENSP00000363286;ENSP00000368349;ENSP00000368458;ENSP00000369335;ENSP00000406046;ENSP00000420176;ENSP00000420588;ENSP00000442563;ENSP00000462664;ENSP00000462963;ENSP00000465759;ENSP00000473233;ENSP00000480186	POLE2;CHRAC1;RPA3;MAD2L2;POLK;REV1;LIG1;POLD3;ZRANB3;POLA2;POLG;UHRF2;PCLAF;DONSON;POLD4;RCHY1;POLE;REV3L;TFB2M;POLH;RPA4;POLE3;POLA1;PCNA;FBH1;POLD1;POLE4;TFAM;POLG2;POLI;TEFM;POLRMT;None;POLD2	DNA polymerase epsilon 2, accessory subunit [Source:HGNC Symbol;Acc:HGNC:9178] ~ chromatin accessibility complex subunit 1 [Source:HGNC Symbol;Acc:HGNC:13544] ~ replication protein A3 [Source:HGNC Symbol;Acc:HGNC:10291] ~ mitotic arrest deficient 2 like 2 [Source:HGNC Symbol;Acc:HGNC:6764] ~ DNA polymerase kappa [Source:HGNC Symbol;Acc:HGNC:9183] ~ REV1 DNA directed polymerase [Source:HGNC Symbol;Acc:HGNC:14060] ~ DNA ligase 1 [Source:HGNC Symbol;Acc:HGNC:6598] ~ DNA polymerase delta 3, accessory subunit [Source:HGNC Symbol;Acc:HGNC:20932] ~ zinc finger RANBP2-type containing 3 [Source:HGNC Symbol;Acc:HGNC:25249] ~ DNA polymerase alpha 2, accessory subunit [Source:HGNC Symbol;Acc:HGNC:30073] ~ DNA polymerase gamma, catalytic subunit [Source:HGNC Symbol;Acc:HGNC:9179] ~ ubiquitin like with PHD and ring finger domains 2 [Source:HGNC Symbol;Acc:HGNC:12557] ~ PCNA clamp associated factor [Source:HGNC Symbol;Acc:HGNC:28961] ~ DNA replication fork stabilization factor DONSON [Source:HGNC Symbol;Acc:HGNC:2993] ~ DNA polymerase delta 4, accessory subunit [Source:HGNC Symbol;Acc:HGNC:14106] ~ ring finger and CHY zinc finger domain containing 1 [Source:HGNC Symbol;Acc:HGNC:17479] ~ DNA polymerase epsilon, catalytic subunit [Source:HGNC Symbol;Acc:HGNC:9177] ~ REV3 like, DNA directed polymerase zeta catalytic subunit [Source:HGNC Symbol;Acc:HGNC:9968] ~ transcription factor B2, mitochondrial [Source:HGNC Symbol;Acc:HGNC:18559] ~ DNA polymerase eta [Source:HGNC Symbol;Acc:HGNC:9181] ~ replication protein A4 [Source:HGNC Symbol;Acc:HGNC:30305] ~ DNA polymerase epsilon 3, accessory subunit [Source:HGNC Symbol;Acc:HGNC:13546] ~ DNA polymerase alpha 1, catalytic subunit [Source:HGNC Symbol;Acc:HGNC:9173] ~ proliferating cell nuclear antigen [Source:HGNC Symbol;Acc:HGNC:8729] ~ F-box DNA helicase 1 [Source:HGNC Symbol;Acc:HGNC:13620] ~ DNA polymerase delta 1, catalytic subunit [Source:HGNC Symbol;Acc:HGNC:9175] ~ DNA polymerase epsilon 4, accessory subunit [Source:HGNC Symbol;Acc:HGNC:18755] ~ transcription factor A, mitochondrial [Source:HGNC Symbol;Acc:HGNC:11741] ~ DNA polymerase gamma 2, accessory subunit [Source:HGNC Symbol;Acc:HGNC:9180] ~ DNA polymerase iota [Source:HGNC Symbol;Acc:HGNC:9182] ~ transcription elongation factor, mitochondrial [Source:HGNC Symbol;Acc:HGNC:26223] ~ RNA polymerase mitochondrial [Source:HGNC Symbol;Acc:HGNC:9200] ~ None ~ DNA polymerase delta 2, accessory subunit [Source:HGNC Symbol;Acc:HGNC:9176]
140	R1	e019_R1	protein folding	GO:0006457	NA	NA	GO:0006457	ENSP00000216479;ENSP00000252037;ENSP00000268876;ENSP00000279146;ENSP00000303754;ENSP00000319255;ENSP00000325120;ENSP00000331103;ENSP00000335153;ENSP00000360609;ENSP00000361900;ENSP00000364298;ENSP00000371278;ENSP00000377970;ENSP00000406463;ENSP00000407487;ENSP00000419184	AHSA1;FKBP6;UNC45B;AIP;PPID;CHORDC1;PGR;IP6K2;HSP90AA1;HSP90AB1;TOMM34;FKBPL;CDC37L1;None;DNAJC7;UNC45A;SMYD3	activator of HSP90 ATPase activity 1 [Source:HGNC Symbol;Acc:HGNC:1189] ~ FKBP prolyl isomerase family member 6 (inactive) [Source:HGNC Symbol;Acc:HGNC:3722] ~ unc-45 myosin chaperone B [Source:HGNC Symbol;Acc:HGNC:14304] ~ aryl hydrocarbon receptor interacting protein [Source:HGNC Symbol;Acc:HGNC:358] ~ peptidylprolyl isomerase D [Source:HGNC Symbol;Acc:HGNC:9257] ~ cysteine and histidine rich domain containing 1 [Source:HGNC Symbol;Acc:HGNC:14525] ~ progesterone receptor [Source:HGNC Symbol;Acc:HGNC:8910] ~ inositol hexakisphosphate kinase 2 [Source:HGNC Symbol;Acc:HGNC:17313] ~ heat shock protein 90 alpha family class A member 1 [Source:HGNC Symbol;Acc:HGNC:5253] ~ heat shock protein 90 alpha family class B member 1 [Source:HGNC Symbol;Acc:HGNC:5258] ~ translocase of outer mitochondrial membrane 34 [Source:HGNC Symbol;Acc:HGNC:15746] ~ FKBP prolyl isomerase like [Source:HGNC Symbol;Acc:HGNC:13949] ~ cell division cycle 37 like 1, HSP90 cochaperone [Source:HGNC Symbol;Acc:HGNC:17179] ~ None ~ DnaJ heat shock protein family (Hsp40) member C7 [Source:HGNC Symbol;Acc:HGNC:12392] ~ unc-45 myosin chaperone A [Source:HGNC Symbol;Acc:HGNC:30594] ~ SET and MYND domain containing 3 [Source:HGNC Symbol;Acc:HGNC:15513]
141	R1	e019_R1	sphingoid biosynthetic process / Sphingolipid de novo biosynthesis	GO:0046520	NA	REAC:R-HSA-1660661	GO:0043603;GO:0006066;GO:0044255	ENSP00000216484;ENSP00000262554;ENSP00000298130;ENSP00000349689;ENSP00000350378;ENSP00000352097;ENSP00000377724;ENSP00000381968	SPTLC2;SPTLC1;SPTSSA;ZDHHC9;GOLGA7;SPTSSB;ORMDL3;SPTLC3	serine palmitoyltransferase long chain base subunit 2 [Source:HGNC Symbol;Acc:HGNC:11278] ~ serine palmitoyltransferase long chain base subunit 1 [Source:HGNC Symbol;Acc:HGNC:11277] ~ serine palmitoyltransferase small subunit A [Source:HGNC Symbol;Acc:HGNC:20361] ~ zinc finger DHHC-type palmitoyltransferase 9 [Source:HGNC Symbol;Acc:HGNC:18475] ~ golgin A7 [Source:HGNC Symbol;Acc:HGNC:24876] ~ serine palmitoyltransferase small subunit B [Source:HGNC Symbol;Acc:HGNC:24045] ~ ORMDL sphingolipid biosynthesis regulator 3 [Source:HGNC Symbol;Acc:HGNC:16038] ~ serine palmitoyltransferase long chain base subunit 3 [Source:HGNC Symbol;Acc:HGNC:16253]
142	R1	e019_R1	actin cytoskeleton organization	GO:0030036	NA	NA	GO:0006996	ENSP00000216487;ENSP00000253754;ENSP00000265944;ENSP00000283131;ENSP00000285735;ENSP00000291906;ENSP00000304283;ENSP00000311513;ENSP00000334563;ENSP00000335655;ENSP00000339299;ENSP00000344871;ENSP00000348349;ENSP00000352264;ENSP00000352834;ENSP00000358994;ENSP00000367059;ENSP00000370968;ENSP00000393392;ENSP00000413697	RIN3;PDLIM4;None;SMARCA5;RHOC;PKN3;RAC3;RSF1;MYO18B;FMNL3;TRIO;MYO9A;CD2AP;MYO6;MYBBP1A;MYO1A;TOM1	Ras and Rab interactor 3 [Source:HGNC Symbol;Acc:HGNC:18751] ~ PDZ and LIM domain 4 [Source:HGNC Symbol;Acc:HGNC:16501] ~ None ~ SWI/SNF related, matrix associated, actin dependent regulator of chromatin, subfamily a, member 5 [Source:HGNC Symbol;Acc:HGNC:11101] ~ ras homolog family member C [Source:HGNC Symbol;Acc:HGNC:669] ~ protein kinase N3 [Source:HGNC Symbol;Acc:HGNC:17999] ~ Rac family small GTPase 3 [Source:HGNC Symbol;Acc:HGNC:9803] ~ remodeling and spacing factor 1 [Source:HGNC Symbol;Acc:HGNC:18118] ~ myosin XVIIIB [Source:HGNC Symbol;Acc:HGNC:18150] ~ formin like 3 [Source:HGNC Symbol;Acc:HGNC:23698] ~ trio Rho guanine nucleotide exchange factor [Source:HGNC Symbol;Acc:HGNC:12303] ~ myosin IXA [Source:HGNC Symbol;Acc:HGNC:7608] ~ CD2 associated protein [Source:HGNC Symbol;Acc:HGNC:14258] ~ myosin VI [Source:HGNC Symbol;Acc:HGNC:7605] ~ MYB binding protein 1a [Source:HGNC Symbol;Acc:HGNC:7546] ~ myosin IA [Source:HGNC Symbol;Acc:HGNC:7595] ~ target of myb1 membrane trafficking protein [Source:HGNC Symbol;Acc:HGNC:11982]
143	R1	e019_R1	positive regulation of fibrinolysis / Complement and coagulation cascades / Intrinsic Pathway of Fibrin Clot Formation	GO:0051919	KEGG:04610	REAC:R-HSA-140837	GO:0006811;GO:0050878;GO:0002376;GO:0050789;GO:0050896	ENSP00000216629;ENSP00000225275;ENSP00000225698;ENSP00000252244;ENSP00000253496;ENSP00000261024;ENSP00000264613;ENSP00000264690;ENSP00000265023;ENSP00000269576;ENSP00000278407;ENSP00000313967;ENSP00000314151;ENSP00000323929;ENSP00000326159;ENSP00000333203;ENSP00000342082;ENSP00000354612;ENSP00000354876;ENSP00000359098;ENSP00000363770;ENSP00000363773;ENSP00000364858;ENSP00000376793;ENSP00000384957;ENSP00000385035;ENSP00000416066;ENSP00000430620;ENSP00000438615;ENSP00000466090;ENSP00000471894;ENSP00000485444	BDKRB1;MPO;C1QBP;KRT1;F12;SLC40A1;CP;KLKB1;None;KRT10;SERPING1;KLK3;A2M;KLK4;SERPINA5;SLPI;PTGS1;MT-CO2;COX7A2;C1QC;C1QA;SERPINA3;F11;C1S;SERPINA1;HEPH;ELANE;HAMP	bradykinin receptor B1 [Source:HGNC Symbol;Acc:HGNC:1029] ~ myeloperoxidase [Source:HGNC Symbol;Acc:HGNC:7218] ~ complement C1q binding protein [Source:HGNC Symbol;Acc:HGNC:1243] ~ keratin 1 [Source:HGNC Symbol;Acc:HGNC:6412] ~ coagulation factor XII [Source:HGNC Symbol;Acc:HGNC:3530] ~ solute carrier family 40 member 1 [Source:HGNC Symbol;Acc:HGNC:10909] ~ ceruloplasmin [Source:HGNC Symbol;Acc:HGNC:2295] ~ kallikrein B1 [Source:HGNC Symbol;Acc:HGNC:6371] ~ None ~ keratin 10 [Source:HGNC Symbol;Acc:HGNC:6413] ~ serpin family G member 1 [Source:HGNC Symbol;Acc:HGNC:1228] ~ kallikrein related peptidase 3 [Source:HGNC Symbol;Acc:HGNC:6364] ~ alpha-2-macroglobulin [Source:HGNC Symbol;Acc:HGNC:7] ~ kallikrein related peptidase 4 [Source:HGNC Symbol;Acc:HGNC:6365] ~ serpin family A member 5 [Source:HGNC Symbol;Acc:HGNC:8723] ~ secretory leukocyte peptidase inhibitor [Source:HGNC Symbol;Acc:HGNC:11092] ~ prostaglandin-endoperoxide synthase 1 [Source:HGNC Symbol;Acc:HGNC:9604] ~ mitochondrially encoded cytochrome c oxidase II [Source:HGNC Symbol;Acc:HGNC:7421] ~ cytochrome c oxidase subunit 7A2 [Source:HGNC Symbol;Acc:HGNC:2288] ~ complement C1q C chain [Source:HGNC Symbol;Acc:HGNC:1245] ~ complement C1q A chain [Source:HGNC Symbol;Acc:HGNC:1241] ~ serpin family A member 3 [Source:HGNC Symbol;Acc:HGNC:16] ~ coagulation factor XI [Source:HGNC Symbol;Acc:HGNC:3529] ~ complement C1s [Source:HGNC Symbol;Acc:HGNC:1247] ~ serpin family A member 1 [Source:HGNC Symbol;Acc:HGNC:8941] ~ hephaestin [Source:HGNC Symbol;Acc:HGNC:4866] ~ elastase, neutrophil expressed [Source:HGNC Symbol;Acc:HGNC:3309] ~ hepcidin antimicrobial peptide [Source:HGNC Symbol;Acc:HGNC:15598]
144	R1	e019_R1	base-excision repair / Base excision repair / APEX1-Independent Resolution of AP Sites via the Single Nucleotide Replacement Pathway	GO:0006284	KEGG:03410	REAC:R-HSA-5649702	GO:0006260;GO:0006281	ENSP00000216714;ENSP00000219302;ENSP00000244520;ENSP00000250416;ENSP00000262887;ENSP00000265421;ENSP00000271620;ENSP00000298139;ENSP00000305480;ENSP00000306561;ENSP00000323511;ENSP00000337060;ENSP00000337353;ENSP00000347170;ENSP00000351185;ENSP00000355759;ENSP00000358262;ENSP00000360869;ENSP00000360883;ENSP00000360891;ENSP00000361777;ENSP00000367787;ENSP00000370150;ENSP00000385269;ENSP00000401371;ENSP00000417864;ENSP00000440402	APEX1;NME3;SNRPC;PARP2;XRCC1;POLB;PRUNE1;WRN;FEN1;OGG1;PNKP;NME1;TDP1;NEIL1;DNA2;PARP1;CHD1L;IFIT1;IFIT3;IFIT2;SET;LIG3;WRNIP1;ELAVL1;TIA1;ANP32A;DDX11	apurinic/apyrimidinic endodeoxyribonuclease 1 [Source:HGNC Symbol;Acc:HGNC:587] ~ NME/NM23 nucleoside diphosphate kinase 3 [Source:HGNC Symbol;Acc:HGNC:7851] ~ small nuclear ribonucleoprotein polypeptide C [Source:HGNC Symbol;Acc:HGNC:11157] ~ poly(ADP-ribose) polymerase 2 [Source:HGNC Symbol;Acc:HGNC:272] ~ X-ray repair cross complementing 1 [Source:HGNC Symbol;Acc:HGNC:12828] ~ DNA polymerase beta [Source:HGNC Symbol;Acc:HGNC:9174] ~ prune exopolyphosphatase 1 [Source:HGNC Symbol;Acc:HGNC:13420] ~ WRN RecQ like helicase [Source:HGNC Symbol;Acc:HGNC:12791] ~ flap structure-specific endonuclease 1 [Source:HGNC Symbol;Acc:HGNC:3650] ~ 8-oxoguanine DNA glycosylase [Source:HGNC Symbol;Acc:HGNC:8125] ~ polynucleotide kinase 3'-phosphatase [Source:HGNC Symbol;Acc:HGNC:9154] ~ NME/NM23 nucleoside diphosphate kinase 1 [Source:HGNC Symbol;Acc:HGNC:7849] ~ tyrosyl-DNA phosphodiesterase 1 [Source:HGNC Symbol;Acc:HGNC:18884] ~ nei like DNA glycosylase 1 [Source:HGNC Symbol;Acc:HGNC:18448] ~ DNA replication helicase/nuclease 2 [Source:HGNC Symbol;Acc:HGNC:2939] ~ poly(ADP-ribose) polymerase 1 [Source:HGNC Symbol;Acc:HGNC:270] ~ chromodomain helicase DNA binding protein 1 like [Source:HGNC Symbol;Acc:HGNC:1916] ~ interferon induced protein with tetratricopeptide repeats 1 [Source:HGNC Symbol;Acc:HGNC:5407] ~ interferon induced protein with tetratricopeptide repeats 3 [Source:HGNC Symbol;Acc:HGNC:5411] ~ interferon induced protein with tetratricopeptide repeats 2 [Source:HGNC Symbol;Acc:HGNC:5409] ~ SET nuclear proto-oncogene [Source:HGNC Symbol;Acc:HGNC:10760] ~ DNA ligase 3 [Source:HGNC Symbol;Acc:HGNC:6600] ~ WRN helicase interacting protein 1 [Source:HGNC Symbol;Acc:HGNC:20876] ~ ELAV like RNA binding protein 1 [Source:HGNC Symbol;Acc:HGNC:3312] ~ TIA1 cytotoxic granule associated RNA binding protein [Source:HGNC Symbol;Acc:HGNC:11802] ~ acidic nuclear phosphoprotein 32 family member A [Source:HGNC Symbol;Acc:HGNC:13233] ~ DEAD/H-box helicase 11 [Source:HGNC Symbol;Acc:HGNC:2736]
145	R1	e019_R1	negative regulation of stem cell population maintenance	GO:1902455	NA	NA	GO:0032502;GO:0050789;GO:0032501	ENSP00000216832;ENSP00000232165;ENSP00000240055;ENSP00000264183;ENSP00000264444;ENSP00000273062;ENSP00000296504;ENSP00000297109;ENSP00000297857;ENSP00000307023;ENSP00000307183;ENSP00000311816;ENSP00000327959;ENSP00000329933;ENSP00000337477;ENSP00000345702;ENSP00000347602;ENSP00000350333;ENSP00000364929;ENSP00000369131;ENSP00000378402;ENSP00000379412;ENSP00000382688;ENSP00000396052;ENSP00000396620;ENSP00000415243;ENSP00000443988;ENSP00000457723;ENSP00000462116;ENSP00000481842	PNN;None;NFYB;ARID4B;MXD1;CTDSP1;SAP30;SAP30L;ZHX1;KLF11;ING2;REST;TGIF1;PHF12;SINHCAF;NFYA;ARID4A;SAP130;ING1;SIN3B;SIN3A;ZNFX1;KDM5A;BRMS1;NFYC;SKIL;SUDS3;RNPS1;SAP30BP;SAP18	pinin, desmosome associated protein [Source:HGNC Symbol;Acc:HGNC:9162] ~ None ~ nuclear transcription factor Y subunit beta [Source:HGNC Symbol;Acc:HGNC:7805] ~ AT-rich interaction domain 4B [Source:HGNC Symbol;Acc:HGNC:15550] ~ MAX dimerization protein 1 [Source:HGNC Symbol;Acc:HGNC:6761] ~ CTD small phosphatase 1 [Source:HGNC Symbol;Acc:HGNC:21614] ~ Sin3A associated protein 30 [Source:HGNC Symbol;Acc:HGNC:10532] ~ SAP30 like [Source:HGNC Symbol;Acc:HGNC:25663] ~ zinc fingers and homeoboxes 1 [Source:HGNC Symbol;Acc:HGNC:12871] ~ KLF transcription factor 11 [Source:HGNC Symbol;Acc:HGNC:11811] ~ inhibitor of growth family member 2 [Source:HGNC Symbol;Acc:HGNC:6063] ~ RE1 silencing transcription factor [Source:HGNC Symbol;Acc:HGNC:9966] ~ TGFB induced factor homeobox 1 [Source:HGNC Symbol;Acc:HGNC:11776] ~ PHD finger protein 12 [Source:HGNC Symbol;Acc:HGNC:20816] ~ SIN3-HDAC complex associated factor [Source:HGNC Symbol;Acc:HGNC:30702] ~ nuclear transcription factor Y subunit alpha [Source:HGNC Symbol;Acc:HGNC:7804] ~ AT-rich interaction domain 4A [Source:HGNC Symbol;Acc:HGNC:9885] ~ Sin3A associated protein 130 [Source:HGNC Symbol;Acc:HGNC:29813] ~ inhibitor of growth family member 1 [Source:HGNC Symbol;Acc:HGNC:6062] ~ SIN3 transcription regulator family member B [Source:HGNC Symbol;Acc:HGNC:19354] ~ SIN3 transcription regulator family member A [Source:HGNC Symbol;Acc:HGNC:19353] ~ zinc finger NFX1-type containing 1 [Source:HGNC Symbol;Acc:HGNC:29271] ~ lysine demethylase 5A [Source:HGNC Symbol;Acc:HGNC:9886] ~ BRMS1 transcriptional repressor and anoikis regulator [Source:HGNC Symbol;Acc:HGNC:17262] ~ nuclear transcription factor Y subunit gamma [Source:HGNC Symbol;Acc:HGNC:7806] ~ SKI like proto-oncogene [Source:HGNC Symbol;Acc:HGNC:10897] ~ SDS3 homolog, SIN3A corepressor complex component [Source:HGNC Symbol;Acc:HGNC:29545] ~ RNA binding protein with serine rich domain 1 [Source:HGNC Symbol;Acc:HGNC:10080] ~ SAP30 binding protein [Source:HGNC Symbol;Acc:HGNC:30785] ~ Sin3A associated protein 18 [Source:HGNC Symbol;Acc:HGNC:10530]
146	R1	e019_R1	spindle organization / Nucleocytoplasmic transport	GO:0007051	KEGG:03013	NA	GO:0050789;GO:0006996	ENSP00000216911;ENSP00000234111;ENSP00000262713;ENSP00000262982;ENSP00000264313;ENSP00000281043;ENSP00000290158;ENSP00000300249;ENSP00000300403;ENSP00000313922;ENSP00000321703;ENSP00000324020;ENSP00000326550;ENSP00000337180;ENSP00000343701;ENSP00000345895;ENSP00000347444;ENSP00000358001;ENSP00000377298;ENSP00000432768;ENSP00000438483;ENSP00000463013;ENSP00000473381;ENSP00000479266	AURKA;ODC1;AJUBA;CSE1L;SLAIN2;MYCN;KPNB1;MAPRE2;TPX2;OAZ3;TACC1;KIF15;TACC3;AZIN1;KPNA1;NUP50;TDRD7;TACC2;NUMA1;CKAP5;KPNA2;OAZ2;OAZ1;BORA	aurora kinase A [Source:HGNC Symbol;Acc:HGNC:11393] ~ ornithine decarboxylase 1 [Source:HGNC Symbol;Acc:HGNC:8109] ~ ajuba LIM protein [Source:HGNC Symbol;Acc:HGNC:20250] ~ chromosome segregation 1 like [Source:HGNC Symbol;Acc:HGNC:2431] ~ SLAIN motif family member 2 [Source:HGNC Symbol;Acc:HGNC:29282] ~ MYCN proto-oncogene, bHLH transcription factor [Source:HGNC Symbol;Acc:HGNC:7559] ~ karyopherin subunit beta 1 [Source:HGNC Symbol;Acc:HGNC:6400] ~ microtubule associated protein RP/EB family member 2 [Source:HGNC Symbol;Acc:HGNC:6891] ~ TPX2 microtubule nucleation factor [Source:HGNC Symbol;Acc:HGNC:1249] ~ ornithine decarboxylase antizyme 3 [Source:HGNC Symbol;Acc:HGNC:8097] ~ transforming acidic coiled-coil containing protein 1 [Source:HGNC Symbol;Acc:HGNC:11522] ~ kinesin family member 15 [Source:HGNC Symbol;Acc:HGNC:17273] ~ transforming acidic coiled-coil containing protein 3 [Source:HGNC Symbol;Acc:HGNC:11524] ~ antizyme inhibitor 1 [Source:HGNC Symbol;Acc:HGNC:16432] ~ karyopherin subunit alpha 1 [Source:HGNC Symbol;Acc:HGNC:6394] ~ nucleoporin 50 [Source:HGNC Symbol;Acc:HGNC:8065] ~ tudor domain containing 7 [Source:HGNC Symbol;Acc:HGNC:30831] ~ transforming acidic coiled-coil containing protein 2 [Source:HGNC Symbol;Acc:HGNC:11523] ~ nuclear mitotic apparatus protein 1 [Source:HGNC Symbol;Acc:HGNC:8059] ~ cytoskeleton associated protein 5 [Source:HGNC Symbol;Acc:HGNC:28959] ~ karyopherin subunit alpha 2 [Source:HGNC Symbol;Acc:HGNC:6395] ~ ornithine decarboxylase antizyme 2 [Source:HGNC Symbol;Acc:HGNC:8096] ~ ornithine decarboxylase antizyme 1 [Source:HGNC Symbol;Acc:HGNC:8095] ~ BORA aurora kinase A activator [Source:HGNC Symbol;Acc:HGNC:24724]
147	R1	e019_R1	Cellular senescence / Transcription of E2F targets under negative control by p107 (RBL1) and p130 (RBL2) in complex with HDAC1	NA	KEGG:04218	REAC:R-HSA-1362300	GO:0050789	ENSP00000217026;ENSP00000222726;ENSP00000222728;ENSP00000234091;ENSP00000238558;ENSP00000239882;ENSP00000262133;ENSP00000262904;ENSP00000267163;ENSP00000272369;ENSP00000290295;ENSP00000291547;ENSP00000301159;ENSP00000303424;ENSP00000314129;ENSP00000329102;ENSP00000341947;ENSP00000343619;ENSP00000345571;ENSP00000351742;ENSP00000355140;ENSP00000355249;ENSP00000357175;ENSP00000362588;ENSP00000362768;ENSP00000364190;ENSP00000364519;ENSP00000368686;ENSP00000398124;ENSP00000405890;ENSP00000420616;ENSP00000421799;ENSP00000426359;ENSP00000439782;ENSP00000451812;ENSP00000453793	MYBL2;HOXA5;HOXA6;ID2;GSC;ELF1;RBL2;E2F3;RB1;MEIS1;HOXB13;PKNOX1;LIN37;PTGDR;TFE3;LIN9;LIN54;HOXA9;E2F1;TFEB;HOXB1;E2F2;ETV3;PBX3;RBL1;PBX2;TFDP1;E2F4;E2F5;PBX1;TFDP2;None;MCIDAS;LIN52;MEIS2	MYB proto-oncogene like 2 [Source:HGNC Symbol;Acc:HGNC:7548] ~ homeobox A5 [Source:HGNC Symbol;Acc:HGNC:5106] ~ homeobox A6 [Source:HGNC Symbol;Acc:HGNC:5107] ~ inhibitor of DNA binding 2 [Source:HGNC Symbol;Acc:HGNC:5361] ~ goosecoid homeobox [Source:HGNC Symbol;Acc:HGNC:4612] ~ E74 like ETS transcription factor 1 [Source:HGNC Symbol;Acc:HGNC:3316] ~ RB transcriptional corepressor like 2 [Source:HGNC Symbol;Acc:HGNC:9894] ~ E2F transcription factor 3 [Source:HGNC Symbol;Acc:HGNC:3115] ~ RB transcriptional corepressor 1 [Source:HGNC Symbol;Acc:HGNC:9884] ~ Meis homeobox 1 [Source:HGNC Symbol;Acc:HGNC:7000] ~ homeobox B13 [Source:HGNC Symbol;Acc:HGNC:5112] ~ PBX/knotted 1 homeobox 1 [Source:HGNC Symbol;Acc:HGNC:9022] ~ lin-37 DREAM MuvB core complex component [Source:HGNC Symbol;Acc:HGNC:33234] ~ prostaglandin D2 receptor [Source:HGNC Symbol;Acc:HGNC:9591] ~ transcription factor binding to IGHM enhancer 3 [Source:HGNC Symbol;Acc:HGNC:11752] ~ lin-9 DREAM MuvB core complex component [Source:HGNC Symbol;Acc:HGNC:30830] ~ lin-54 DREAM MuvB core complex component [Source:HGNC Symbol;Acc:HGNC:25397] ~ homeobox A9 [Source:HGNC Symbol;Acc:HGNC:5109] ~ E2F transcription factor 1 [Source:HGNC Symbol;Acc:HGNC:3113] ~ transcription factor EB [Source:HGNC Symbol;Acc:HGNC:11753] ~ homeobox B1 [Source:HGNC Symbol;Acc:HGNC:5111] ~ E2F transcription factor 2 [Source:HGNC Symbol;Acc:HGNC:3114] ~ ETS variant transcription factor 3 [Source:HGNC Symbol;Acc:HGNC:3492] ~ PBX homeobox 3 [Source:HGNC Symbol;Acc:HGNC:8634] ~ RB transcriptional corepressor like 1 [Source:HGNC Symbol;Acc:HGNC:9893] ~ PBX homeobox 2 [Source:HGNC Symbol;Acc:HGNC:8633] ~ transcription factor Dp-1 [Source:HGNC Symbol;Acc:HGNC:11749] ~ E2F transcription factor 4 [Source:HGNC Symbol;Acc:HGNC:3118] ~ E2F transcription factor 5 [Source:HGNC Symbol;Acc:HGNC:3119] ~ PBX homeobox 1 [Source:HGNC Symbol;Acc:HGNC:8632] ~ transcription factor Dp-2 [Source:HGNC Symbol;Acc:HGNC:11751] ~ None ~ multiciliate differentiation and DNA synthesis associated cell cycle protein [Source:HGNC Symbol;Acc:HGNC:40050] ~ lin-52 DREAM MuvB core complex component [Source:HGNC Symbol;Acc:HGNC:19856] ~ Meis homeobox 2 [Source:HGNC Symbol;Acc:HGNC:7001]
148	R1	e019_R1	endodermal cell fate specification / Transcriptional regulation of pluripotent stem cells	GO:0001714	NA	REAC:R-HSA-452723	GO:0032502	ENSP00000217086;ENSP00000229307;ENSP00000247182;ENSP00000252463;ENSP00000259915;ENSP00000262653;ENSP00000276594;ENSP00000297316;ENSP00000320171;ENSP00000323588;ENSP00000333640;ENSP00000342626;ENSP00000356825;ENSP00000398410;ENSP00000404100;ENSP00000422488;ENSP00000432770;ENSP00000482245	SALL4;NANOG;None;ZSCAN10;POU5F1;CBFA2T2;PRDM14;SOX17;PKM;SOX2;EYA2;EYA1;ADCY10;KDM8;PAX6;ESRRB;EYA4;DACH1	spalt like transcription factor 4 [Source:HGNC Symbol;Acc:HGNC:15924] ~ Nanog homeobox [Source:HGNC Symbol;Acc:HGNC:20857] ~ None ~ zinc finger and SCAN domain containing 10 [Source:HGNC Symbol;Acc:HGNC:12997] ~ POU class 5 homeobox 1 [Source:HGNC Symbol;Acc:HGNC:9221] ~ CBFA2/RUNX1 partner transcriptional co-repressor 2 [Source:HGNC Symbol;Acc:HGNC:1536] ~ PR/SET domain 14 [Source:HGNC Symbol;Acc:HGNC:14001] ~ SRY-box transcription factor 17 [Source:HGNC Symbol;Acc:HGNC:18122] ~ pyruvate kinase M1/2 [Source:HGNC Symbol;Acc:HGNC:9021] ~ SRY-box transcription factor 2 [Source:HGNC Symbol;Acc:HGNC:11195] ~ EYA transcriptional coactivator and phosphatase 2 [Source:HGNC Symbol;Acc:HGNC:3520] ~ EYA transcriptional coactivator and phosphatase 1 [Source:HGNC Symbol;Acc:HGNC:3519] ~ adenylate cyclase 10 [Source:HGNC Symbol;Acc:HGNC:21285] ~ lysine demethylase 8 [Source:HGNC Symbol;Acc:HGNC:25840] ~ paired box 6 [Source:HGNC Symbol;Acc:HGNC:8620] ~ estrogen related receptor beta [Source:HGNC Symbol;Acc:HGNC:3473] ~ EYA transcriptional coactivator and phosphatase 4 [Source:HGNC Symbol;Acc:HGNC:3522] ~ dachshund family transcription factor 1 [Source:HGNC Symbol;Acc:HGNC:2663]
149	R1	e019_R1	microtubule-based process / Salmonella infection / Kinesins	GO:0007017	KEGG:05132	REAC:R-HSA-983189	GO:0006810;GO:0051641;GO:0007049;GO:0006996;GO:0051640;GO:0051261	ENSP00000217133;ENSP00000248437;ENSP00000259708;ENSP00000259818;ENSP00000264071;ENSP00000301071;ENSP00000301072;ENSP00000307078;ENSP00000318697;ENSP00000320295;ENSP00000333326;ENSP00000336799;ENSP00000339001;ENSP00000341289;ENSP00000342538;ENSP00000358894;ENSP00000359685;ENSP00000361298;ENSP00000366513;ENSP00000369703;ENSP00000385000;ENSP00000393379;ENSP00000396954;ENSP00000399403;ENSP00000407118;ENSP00000408979;ENSP00000410452;ENSP00000414982;ENSP00000438388;ENSP00000465992	TUBB1;TUBA4A;KLC4;TUBB2B;TUBB4A;TUBA1A;TUBA1C;KIF5B;TUBB6;TUBB3;TUBA8;TUBA1B;TUBB;TUBB4B;STMN4;CNNM2;None;KIF2C;CLSTN1;TUBB2A;KIF2A;KIF5C;ATF5;KLC2;SYBU;KIF5A;STMN1;KLC1;KIF1A;KIF18B	tubulin beta 1 class VI [Source:HGNC Symbol;Acc:HGNC:16257] ~ tubulin alpha 4a [Source:HGNC Symbol;Acc:HGNC:12407] ~ kinesin light chain 4 [Source:HGNC Symbol;Acc:HGNC:21624] ~ tubulin beta 2B class IIb [Source:HGNC Symbol;Acc:HGNC:30829] ~ tubulin beta 4A class IVa [Source:HGNC Symbol;Acc:HGNC:20774] ~ tubulin alpha 1a [Source:HGNC Symbol;Acc:HGNC:20766] ~ tubulin alpha 1c [Source:HGNC Symbol;Acc:HGNC:20768] ~ kinesin family member 5B [Source:HGNC Symbol;Acc:HGNC:6324] ~ tubulin beta 6 class V [Source:HGNC Symbol;Acc:HGNC:20776] ~ tubulin beta 3 class III [Source:HGNC Symbol;Acc:HGNC:20772] ~ tubulin alpha 8 [Source:HGNC Symbol;Acc:HGNC:12410] ~ tubulin alpha 1b [Source:HGNC Symbol;Acc:HGNC:18809] ~ tubulin beta class I [Source:HGNC Symbol;Acc:HGNC:20778] ~ tubulin beta 4B class IVb [Source:HGNC Symbol;Acc:HGNC:20771] ~ stathmin 4 [Source:HGNC Symbol;Acc:HGNC:16078] ~ cyclin and CBS domain divalent metal cation transport mediator 2 [Source:HGNC Symbol;Acc:HGNC:103] ~ None ~ kinesin family member 2C [Source:HGNC Symbol;Acc:HGNC:6393] ~ calsyntenin 1 [Source:HGNC Symbol;Acc:HGNC:17447] ~ tubulin beta 2A class IIa [Source:HGNC Symbol;Acc:HGNC:12412] ~ kinesin family member 2A [Source:HGNC Symbol;Acc:HGNC:6318] ~ kinesin family member 5C [Source:HGNC Symbol;Acc:HGNC:6325] ~ activating transcription factor 5 [Source:HGNC Symbol;Acc:HGNC:790] ~ kinesin light chain 2 [Source:HGNC Symbol;Acc:HGNC:20716] ~ syntabulin [Source:HGNC Symbol;Acc:HGNC:26011] ~ kinesin family member 5A [Source:HGNC Symbol;Acc:HGNC:6323] ~ stathmin 1 [Source:HGNC Symbol;Acc:HGNC:6510] ~ kinesin light chain 1 [Source:HGNC Symbol;Acc:HGNC:6387] ~ kinesin family member 1A [Source:HGNC Symbol;Acc:HGNC:888] ~ kinesin family member 18B [Source:HGNC Symbol;Acc:HGNC:27102]
