module	monet_type	experiment_info	function_summary	term_id_REAC	term_id_KEGG	term_id_GO_BP	goslim_pir	genes_orig	genes_hugo	genes_descriptions
80	R1	e019_R1	synaptic transmission, cholinergic / Highly calcium permeable nicotinic acetylcholine receptors	REAC:R-HSA-629597	NA	GO:0007271	GO:0007154;GO:0006811;GO:0050877;GO:0065008;GO:0050896;GO:0050789	ENSG00000101204;ENSG00000080644;ENSG00000120903;ENSG00000053918;ENSG00000055118;ENSG00000171385;ENSG00000184408;ENSG00000120049;ENSG00000145888;ENSG00000182132;ENSG00000109738;ENSG00000160716;ENSG00000147432;ENSG00000117971;ENSG00000169684;ENSG00000180509;ENSG00000175548	CHRNA4;CHRNA3;CHRNA2;KCNQ1;KCNH2;KCND3;KCND2;KCNIP2;GLRA1;KCNIP1;GLRB;CHRNB2;CHRNB3;CHRNB4;CHRNA5;KCNE1;ALG10B	cholinergic receptor nicotinic alpha 4 subunit [Source:HGNC Symbol;Acc:HGNC:1958] ~ cholinergic receptor nicotinic alpha 3 subunit [Source:HGNC Symbol;Acc:HGNC:1957] ~ cholinergic receptor nicotinic alpha 2 subunit [Source:HGNC Symbol;Acc:HGNC:1956] ~ potassium voltage-gated channel subfamily Q member 1 [Source:HGNC Symbol;Acc:HGNC:6294] ~ potassium voltage-gated channel subfamily H member 2 [Source:HGNC Symbol;Acc:HGNC:6251] ~ potassium voltage-gated channel subfamily D member 3 [Source:HGNC Symbol;Acc:HGNC:6239] ~ potassium voltage-gated channel subfamily D member 2 [Source:HGNC Symbol;Acc:HGNC:6238] ~ potassium voltage-gated channel interacting protein 2 [Source:HGNC Symbol;Acc:HGNC:15522] ~ glycine receptor alpha 1 [Source:HGNC Symbol;Acc:HGNC:4326] ~ potassium voltage-gated channel interacting protein 1 [Source:HGNC Symbol;Acc:HGNC:15521] ~ glycine receptor beta [Source:HGNC Symbol;Acc:HGNC:4329] ~ cholinergic receptor nicotinic beta 2 subunit [Source:HGNC Symbol;Acc:HGNC:1962] ~ cholinergic receptor nicotinic beta 3 subunit [Source:HGNC Symbol;Acc:HGNC:1963] ~ cholinergic receptor nicotinic beta 4 subunit [Source:HGNC Symbol;Acc:HGNC:1964] ~ cholinergic receptor nicotinic alpha 5 subunit [Source:HGNC Symbol;Acc:HGNC:1959] ~ potassium voltage-gated channel subfamily E regulatory subunit 1 [Source:HGNC Symbol;Acc:HGNC:6240] ~ ALG10 alpha-1,2-glucosyltransferase B [Source:HGNC Symbol;Acc:HGNC:31088]
81	R1	e019_R1	rRNA processing / Ribosome biogenesis in eukaryotes / rRNA modification in the nucleus and cytosol	REAC:R-HSA-6790901	KEGG:03008	GO:0006364	GO:0006396;GO:0042254	ENSG00000130826;ENSG00000055044;ENSG00000070495;ENSG00000171490;ENSG00000145912;ENSG00000106344;ENSG00000163938;ENSG00000115946;ENSG00000156697;ENSG00000109534;ENSG00000065183;ENSG00000135372;ENSG00000070814;ENSG00000008056;ENSG00000083635;ENSG00000177971;ENSG00000124383;ENSG00000165271;ENSG00000101361;ENSG00000107833;ENSG00000158806;ENSG00000117174;ENSG00000114767;ENSG00000136718;ENSG00000157152;ENSG00000183751;ENSG00000182117;ENSG00000183520;ENSG00000185666	DKC1;NOP58;JMJD6;RSL1D1;NHP2;RBM28;GNL3;PNO1;UTP14A;GAR1;WDR3;NAT10;TCOF1;SYN1;NUFIP1;IMP3;MPHOSPH10;NOL6;NOP56;NPM3;NPM2;ZNHIT6;RRP9;IMP4;SYN2;TBL3;NOP10;UTP11;SYN3	dyskerin pseudouridine synthase 1 [Source:HGNC Symbol;Acc:HGNC:2890] ~ NOP58 ribonucleoprotein [Source:HGNC Symbol;Acc:HGNC:29926] ~ jumonji domain containing 6, arginine demethylase and lysine hydroxylase [Source:HGNC Symbol;Acc:HGNC:19355] ~ ribosomal L1 domain containing 1 [Source:HGNC Symbol;Acc:HGNC:24534] ~ NHP2 ribonucleoprotein [Source:HGNC Symbol;Acc:HGNC:14377] ~ RNA binding motif protein 28 [Source:HGNC Symbol;Acc:HGNC:21863] ~ G protein nucleolar 3 [Source:HGNC Symbol;Acc:HGNC:29931] ~ partner of NOB1 homolog [Source:HGNC Symbol;Acc:HGNC:32790] ~ UTP14A small subunit processome component [Source:HGNC Symbol;Acc:HGNC:10665] ~ GAR1 ribonucleoprotein [Source:HGNC Symbol;Acc:HGNC:14264] ~ WD repeat domain 3 [Source:HGNC Symbol;Acc:HGNC:12755] ~ N-acetyltransferase 10 [Source:HGNC Symbol;Acc:HGNC:29830] ~ treacle ribosome biogenesis factor 1 [Source:HGNC Symbol;Acc:HGNC:11654] ~ synapsin I [Source:HGNC Symbol;Acc:HGNC:11494] ~ nuclear FMR1 interacting protein 1 [Source:HGNC Symbol;Acc:HGNC:8057] ~ IMP U3 small nucleolar ribonucleoprotein 3 [Source:HGNC Symbol;Acc:HGNC:14497] ~ M-phase phosphoprotein 10 [Source:HGNC Symbol;Acc:HGNC:7213] ~ nucleolar protein 6 [Source:HGNC Symbol;Acc:HGNC:19910] ~ NOP56 ribonucleoprotein [Source:HGNC Symbol;Acc:HGNC:15911] ~ nucleophosmin/nucleoplasmin 3 [Source:HGNC Symbol;Acc:HGNC:7931] ~ nucleophosmin/nucleoplasmin 2 [Source:HGNC Symbol;Acc:HGNC:7930] ~ zinc finger HIT-type containing 6 [Source:HGNC Symbol;Acc:HGNC:26089] ~ ribosomal RNA processing 9, U3 small nucleolar RNA binding protein [Source:HGNC Symbol;Acc:HGNC:16829] ~ IMP U3 small nucleolar ribonucleoprotein 4 [Source:HGNC Symbol;Acc:HGNC:30856] ~ synapsin II [Source:HGNC Symbol;Acc:HGNC:11495] ~ transducin beta like 3 [Source:HGNC Symbol;Acc:HGNC:11587] ~ NOP10 ribonucleoprotein [Source:HGNC Symbol;Acc:HGNC:14378] ~ UTP11 small subunit processome component [Source:HGNC Symbol;Acc:HGNC:24329] ~ synapsin III [Source:HGNC Symbol;Acc:HGNC:11496]
82	R1	e019_R1	nucleosome assembly / Systemic lupus erythematosus / DNA Damage/Telomere Stress Induced Senescence	REAC:R-HSA-2559586	KEGG:05322	GO:0006334	GO:0065003	ENSG00000085224;ENSG00000165671;ENSG00000100297;ENSG00000127483;ENSG00000184357;ENSG00000158373;ENSG00000168148;ENSG00000189060;ENSG00000168298;ENSG00000137492;ENSG00000203814;ENSG00000183598;ENSG00000124610;ENSG00000100038;ENSG00000275713;ENSG00000170364;ENSG00000100814;ENSG00000205581;ENSG00000118418;ENSG00000185130;ENSG00000188375;ENSG00000184678;ENSG00000187837;ENSG00000164032;ENSG00000234289;ENSG00000105968;ENSG00000274997;ENSG00000184897;ENSG00000198830;ENSG00000187475;ENSG00000124635;ENSG00000124575;ENSG00000197903;ENSG00000164508;ENSG00000146047;ENSG00000273703;ENSG00000103021;ENSG00000204406;ENSG00000196866;ENSG00000276410;ENSG00000274641;ENSG00000275663	ATRX;NSD1;MCM5;HP1BP3;H1-5;H2BC5;H3-4;H1-0;H1-4;THAP12;H2BC18;H3C13;H1-1;TOP3B;H2BC9;SETMAR;CCNB1IP1;HMGN1;HMGN3;H2BC13;H3-5;H2BC21;H1-2;H2AZ1;H2BC12L;H2AZ2;H2AC12;H1-10;HMGN2;H1-6;H2BC11;H1-3;H2BC12;H2AC1;H2BC1;H2BC14;CCDC113;MBD5;H2AC7;H2BC3;H2BC17;H4C7	ATRX chromatin remodeler [Source:HGNC Symbol;Acc:HGNC:886] ~ nuclear receptor binding SET domain protein 1 [Source:HGNC Symbol;Acc:HGNC:14234] ~ minichromosome maintenance complex component 5 [Source:HGNC Symbol;Acc:HGNC:6948] ~ heterochromatin protein 1 binding protein 3 [Source:HGNC Symbol;Acc:HGNC:24973] ~ H1.5 linker histone, cluster member [Source:HGNC Symbol;Acc:HGNC:4719] ~ H2B clustered histone 5 [Source:HGNC Symbol;Acc:HGNC:4747] ~ H3.4 histone, cluster member [Source:HGNC Symbol;Acc:HGNC:4778] ~ H1.0 linker histone [Source:HGNC Symbol;Acc:HGNC:4714] ~ H1.4 linker histone, cluster member [Source:HGNC Symbol;Acc:HGNC:4718] ~ THAP domain containing 12 [Source:HGNC Symbol;Acc:HGNC:9440] ~ H2B clustered histone 18 [Source:HGNC Symbol;Acc:HGNC:24700] ~ H3 clustered histone 13 [Source:HGNC Symbol;Acc:HGNC:25311] ~ H1.1 linker histone, cluster member [Source:HGNC Symbol;Acc:HGNC:4715] ~ DNA topoisomerase III beta [Source:HGNC Symbol;Acc:HGNC:11993] ~ H2B clustered histone 9 [Source:HGNC Symbol;Acc:HGNC:4755] ~ SET domain and mariner transposase fusion gene [Source:HGNC Symbol;Acc:HGNC:10762] ~ cyclin B1 interacting protein 1 [Source:HGNC Symbol;Acc:HGNC:19437] ~ high mobility group nucleosome binding domain 1 [Source:HGNC Symbol;Acc:HGNC:4984] ~ high mobility group nucleosomal binding domain 3 [Source:HGNC Symbol;Acc:HGNC:12312] ~ H2B clustered histone 13 [Source:HGNC Symbol;Acc:HGNC:4748] ~ H3.5 histone [Source:HGNC Symbol;Acc:HGNC:33164] ~ H2B clustered histone 21 [Source:HGNC Symbol;Acc:HGNC:4760] ~ H1.2 linker histone, cluster member [Source:HGNC Symbol;Acc:HGNC:4716] ~ H2A.Z variant histone 1 [Source:HGNC Symbol;Acc:HGNC:4741] ~ H2B clustered histone 12 like [Source:HGNC Symbol;Acc:HGNC:4762] ~ H2A.Z variant histone 2 [Source:HGNC Symbol;Acc:HGNC:20664] ~ H2A clustered histone 12 [Source:HGNC Symbol;Acc:HGNC:13671] ~ H1.10 linker histone [Source:HGNC Symbol;Acc:HGNC:4722] ~ high mobility group nucleosomal binding domain 2 [Source:HGNC Symbol;Acc:HGNC:4986] ~ H1.6 linker histone, cluster member [Source:HGNC Symbol;Acc:HGNC:4720] ~ H2B clustered histone 11 [Source:HGNC Symbol;Acc:HGNC:4761] ~ H1.3 linker histone, cluster member [Source:HGNC Symbol;Acc:HGNC:4717] ~ H2B clustered histone 12 [Source:HGNC Symbol;Acc:HGNC:13954] ~ H2A clustered histone 1 [Source:HGNC Symbol;Acc:HGNC:18729] ~ H2B clustered histone 1 [Source:HGNC Symbol;Acc:HGNC:18730] ~ H2B clustered histone 14 [Source:HGNC Symbol;Acc:HGNC:4750] ~ coiled-coil domain containing 113 [Source:HGNC Symbol;Acc:HGNC:25002] ~ methyl-CpG binding domain protein 5 [Source:HGNC Symbol;Acc:HGNC:20444] ~ H2A clustered histone 7 [Source:HGNC Symbol;Acc:HGNC:4729] ~ H2B clustered histone 3 [Source:HGNC Symbol;Acc:HGNC:4751] ~ H2B clustered histone 17 [Source:HGNC Symbol;Acc:HGNC:4758] ~ H4 clustered histone 7 [Source:HGNC Symbol;Acc:HGNC:4792]
83	R1	e019_R1	Adipocytokine signaling pathway / TNFs bind their physiological receptors	REAC:R-HSA-5669034	KEGG:04920	NA	GO:0050789	ENSG00000067182;ENSG00000113905;ENSG00000028137;ENSG00000150337;ENSG00000121858;ENSG00000166579;ENSG00000101336;ENSG00000133124;ENSG00000156735;ENSG00000122417;ENSG00000111052;ENSG00000168807;ENSG00000164761	TNFRSF1A;HRG;TNFRSF1B;FCGR1A;TNFSF10;NDEL1;HCK;IRS4;BAG4;ODF2L;LIN7A;SNTB2;TNFRSF11B	TNF receptor superfamily member 1A [Source:HGNC Symbol;Acc:HGNC:11916] ~ histidine rich glycoprotein [Source:HGNC Symbol;Acc:HGNC:5181] ~ TNF receptor superfamily member 1B [Source:HGNC Symbol;Acc:HGNC:11917] ~ Fc gamma receptor Ia [Source:HGNC Symbol;Acc:HGNC:3613] ~ TNF superfamily member 10 [Source:HGNC Symbol;Acc:HGNC:11925] ~ nudE neurodevelopment protein 1 like 1 [Source:HGNC Symbol;Acc:HGNC:17620] ~ HCK proto-oncogene, Src family tyrosine kinase [Source:HGNC Symbol;Acc:HGNC:4840] ~ insulin receptor substrate 4 [Source:HGNC Symbol;Acc:HGNC:6128] ~ BAG cochaperone 4 [Source:HGNC Symbol;Acc:HGNC:940] ~ outer dense fiber of sperm tails 2 like [Source:HGNC Symbol;Acc:HGNC:29225] ~ lin-7 homolog A, crumbs cell polarity complex component [Source:HGNC Symbol;Acc:HGNC:17787] ~ syntrophin beta 2 [Source:HGNC Symbol;Acc:HGNC:11169] ~ TNF receptor superfamily member 11b [Source:HGNC Symbol;Acc:HGNC:11909]
84	R1	e019_R1	negative regulation of intestinal lipid absorption / Defective ABCG5 causes sitosterolemia	REAC:R-HSA-5679096	NA	GO:1904730	GO:0032501;GO:0050789;GO:0006869	ENSG00000104689;ENSG00000138075;ENSG00000182718;ENSG00000240583;ENSG00000108848;ENSG00000185499;ENSG00000147676;ENSG00000184451;ENSG00000102030;ENSG00000196154;ENSG00000185567;ENSG00000164283;ENSG00000184502;ENSG00000183023;ENSG00000090316;ENSG00000113739;ENSG00000126353;ENSG00000169906;ENSG00000197956;ENSG00000127412;ENSG00000197747;ENSG00000104537;ENSG00000171303;ENSG00000047457;ENSG00000144837;ENSG00000143921;ENSG00000187021	TNFRSF10A;ABCG5;ANXA2;AQP1;LUC7L3;MUC1;MAL2;CCR10;NAA10;S100A4;AHNAK2;ESM1;GAST;SLC8A1;MAEA;STC2;CCR7;S100G;S100A6;TRPV5;S100A10;ANXA13;KCNK3;CP;PLA1A;ABCG8;PNLIPRP1	TNF receptor superfamily member 10a [Source:HGNC Symbol;Acc:HGNC:11904] ~ ATP binding cassette subfamily G member 5 [Source:HGNC Symbol;Acc:HGNC:13886] ~ annexin A2 [Source:HGNC Symbol;Acc:HGNC:537] ~ aquaporin 1 (Colton blood group) [Source:HGNC Symbol;Acc:HGNC:633] ~ LUC7 like 3 pre-mRNA splicing factor [Source:HGNC Symbol;Acc:HGNC:24309] ~ mucin 1, cell surface associated [Source:HGNC Symbol;Acc:HGNC:7508] ~ mal, T cell differentiation protein 2 [Source:HGNC Symbol;Acc:HGNC:13634] ~ C-C motif chemokine receptor 10 [Source:HGNC Symbol;Acc:HGNC:4474] ~ N-alpha-acetyltransferase 10, NatA catalytic subunit [Source:HGNC Symbol;Acc:HGNC:18704] ~ S100 calcium binding protein A4 [Source:HGNC Symbol;Acc:HGNC:10494] ~ AHNAK nucleoprotein 2 [Source:HGNC Symbol;Acc:HGNC:20125] ~ endothelial cell specific molecule 1 [Source:HGNC Symbol;Acc:HGNC:3466] ~ gastrin [Source:HGNC Symbol;Acc:HGNC:4164] ~ solute carrier family 8 member A1 [Source:HGNC Symbol;Acc:HGNC:11068] ~ macrophage erythroblast attacher, E3 ubiquitin ligase [Source:HGNC Symbol;Acc:HGNC:13731] ~ stanniocalcin 2 [Source:HGNC Symbol;Acc:HGNC:11374] ~ C-C motif chemokine receptor 7 [Source:HGNC Symbol;Acc:HGNC:1608] ~ S100 calcium binding protein G [Source:HGNC Symbol;Acc:HGNC:1436] ~ S100 calcium binding protein A6 [Source:HGNC Symbol;Acc:HGNC:10496] ~ transient receptor potential cation channel subfamily V member 5 [Source:HGNC Symbol;Acc:HGNC:3145] ~ S100 calcium binding protein A10 [Source:HGNC Symbol;Acc:HGNC:10487] ~ annexin A13 [Source:HGNC Symbol;Acc:HGNC:536] ~ potassium two pore domain channel subfamily K member 3 [Source:HGNC Symbol;Acc:HGNC:6278] ~ ceruloplasmin [Source:HGNC Symbol;Acc:HGNC:2295] ~ phospholipase A1 member A [Source:HGNC Symbol;Acc:HGNC:17661] ~ ATP binding cassette subfamily G member 8 [Source:HGNC Symbol;Acc:HGNC:13887] ~ pancreatic lipase related protein 1 [Source:HGNC Symbol;Acc:HGNC:9156]
85	R1	e019_R1	Natural killer cell mediated cytotoxicity	NA	KEGG:04650	NA	NA	ENSG00000064300;ENSG00000148053;ENSG00000010017;ENSG00000100351;ENSG00000160691;ENSG00000106211;ENSG00000123505;ENSG00000141934;ENSG00000131019;ENSG00000203722;ENSG00000162407;ENSG00000151079;ENSG00000111981;ENSG00000135678;ENSG00000177272;ENSG00000182255	NGFR;NTRK2;RANBP9;GRAP2;SHC1;HSPB1;AMD1;PLPP2;ULBP3;RAET1G;PLPP3;KCNA6;ULBP1;CPM;KCNA3;KCNA4	nerve growth factor receptor [Source:HGNC Symbol;Acc:HGNC:7809] ~ neurotrophic receptor tyrosine kinase 2 [Source:HGNC Symbol;Acc:HGNC:8032] ~ RAN binding protein 9 [Source:HGNC Symbol;Acc:HGNC:13727] ~ GRB2 related adaptor protein 2 [Source:HGNC Symbol;Acc:HGNC:4563] ~ SHC adaptor protein 1 [Source:HGNC Symbol;Acc:HGNC:10840] ~ heat shock protein family B (small) member 1 [Source:HGNC Symbol;Acc:HGNC:5246] ~ adenosylmethionine decarboxylase 1 [Source:HGNC Symbol;Acc:HGNC:457] ~ phospholipid phosphatase 2 [Source:HGNC Symbol;Acc:HGNC:9230] ~ UL16 binding protein 3 [Source:HGNC Symbol;Acc:HGNC:14895] ~ retinoic acid early transcript 1G [Source:HGNC Symbol;Acc:HGNC:16795] ~ phospholipid phosphatase 3 [Source:HGNC Symbol;Acc:HGNC:9229] ~ potassium voltage-gated channel subfamily A member 6 [Source:HGNC Symbol;Acc:HGNC:6225] ~ UL16 binding protein 1 [Source:HGNC Symbol;Acc:HGNC:14893] ~ carboxypeptidase M [Source:HGNC Symbol;Acc:HGNC:2311] ~ potassium voltage-gated channel subfamily A member 3 [Source:HGNC Symbol;Acc:HGNC:6221] ~ potassium voltage-gated channel subfamily A member 4 [Source:HGNC Symbol;Acc:HGNC:6222]
86	R1	e019_R1	NF-kappa B signaling pathway	NA	KEGG:04064	NA	NA	ENSG00000172936;ENSG00000162434;ENSG00000010671;ENSG00000165025;ENSG00000141699;ENSG00000135211;ENSG00000157765;ENSG00000138650;ENSG00000165682	MYD88;JAK1;BTK;SYK;RETREG3;TMEM60;SLC34A2;PCDH10;CLEC1B	MYD88 innate immune signal transduction adaptor [Source:HGNC Symbol;Acc:HGNC:7562] ~ Janus kinase 1 [Source:HGNC Symbol;Acc:HGNC:6190] ~ Bruton tyrosine kinase [Source:HGNC Symbol;Acc:HGNC:1133] ~ spleen associated tyrosine kinase [Source:HGNC Symbol;Acc:HGNC:11491] ~ reticulophagy regulator family member 3 [Source:HGNC Symbol;Acc:HGNC:27258] ~ transmembrane protein 60 [Source:HGNC Symbol;Acc:HGNC:21754] ~ solute carrier family 34 member 2 [Source:HGNC Symbol;Acc:HGNC:11020] ~ protocadherin 10 [Source:HGNC Symbol;Acc:HGNC:13404] ~ C-type lectin domain family 1 member B [Source:HGNC Symbol;Acc:HGNC:24356]
87	R1	e019_R1	E3 ubiquitin ligases ubiquitinate target proteins	REAC:R-HSA-8866654	NA	NA	NA	ENSG00000070950;ENSG00000137807;ENSG00000107077;ENSG00000167657;ENSG00000102081;ENSG00000137601;ENSG00000143537;ENSG00000075702;ENSG00000176896;ENSG00000242220;ENSG00000184260;ENSG00000119048;ENSG00000140382;ENSG00000072364;ENSG00000101596;ENSG00000077721;ENSG00000103494;ENSG00000146414;ENSG00000099814;ENSG00000113971;ENSG00000024048;ENSG00000142945;ENSG00000214717;ENSG00000144061;ENSG00000174442;ENSG00000141200;ENSG00000175970;ENSG00000187522	RAD18;KIF23;KDM4C;DAPK3;FMR1;NEK1;ADAM15;WDR62;TCEANC;TCP10L;H2AC20;UBE2B;HMG20A;AFF4;SMCHD1;UBE2A;RPGRIP1L;SHPRH;CEP170B;NPHP3;UBR2;KIF2C;ZBED1;NPHP1;ZWILCH;KIF2B;UNC119B;HSPA14	RAD18 E3 ubiquitin protein ligase [Source:HGNC Symbol;Acc:HGNC:18278] ~ kinesin family member 23 [Source:HGNC Symbol;Acc:HGNC:6392] ~ lysine demethylase 4C [Source:HGNC Symbol;Acc:HGNC:17071] ~ death associated protein kinase 3 [Source:HGNC Symbol;Acc:HGNC:2676] ~ fragile X messenger ribonucleoprotein 1 [Source:HGNC Symbol;Acc:HGNC:3775] ~ NIMA related kinase 1 [Source:HGNC Symbol;Acc:HGNC:7744] ~ ADAM metallopeptidase domain 15 [Source:HGNC Symbol;Acc:HGNC:193] ~ WD repeat domain 62 [Source:HGNC Symbol;Acc:HGNC:24502] ~ transcription elongation factor A N-terminal and central domain containing [Source:HGNC Symbol;Acc:HGNC:28277] ~ t-complex 10 like [Source:HGNC Symbol;Acc:HGNC:11657] ~ H2A clustered histone 20 [Source:HGNC Symbol;Acc:HGNC:4738] ~ ubiquitin conjugating enzyme E2 B [Source:HGNC Symbol;Acc:HGNC:12473] ~ high mobility group 20A [Source:HGNC Symbol;Acc:HGNC:5001] ~ ALF transcription elongation factor 4 [Source:HGNC Symbol;Acc:HGNC:17869] ~ structural maintenance of chromosomes flexible hinge domain containing 1 [Source:HGNC Symbol;Acc:HGNC:29090] ~ ubiquitin conjugating enzyme E2 A [Source:HGNC Symbol;Acc:HGNC:12472] ~ RPGRIP1 like [Source:HGNC Symbol;Acc:HGNC:29168] ~ SNF2 histone linker PHD RING helicase [Source:HGNC Symbol;Acc:HGNC:19336] ~ centrosomal protein 170B [Source:HGNC Symbol;Acc:HGNC:20362] ~ nephrocystin 3 [Source:HGNC Symbol;Acc:HGNC:7907] ~ ubiquitin protein ligase E3 component n-recognin 2 [Source:HGNC Symbol;Acc:HGNC:21289] ~ kinesin family member 2C [Source:HGNC Symbol;Acc:HGNC:6393] ~ zinc finger BED-type containing 1 [Source:HGNC Symbol;Acc:HGNC:447] ~ nephrocystin 1 [Source:HGNC Symbol;Acc:HGNC:7905] ~ zwilch kinetochore protein [Source:HGNC Symbol;Acc:HGNC:25468] ~ kinesin family member 2B [Source:HGNC Symbol;Acc:HGNC:29443] ~ unc-119 lipid binding chaperone B [Source:HGNC Symbol;Acc:HGNC:16488] ~ heat shock protein family A (Hsp70) member 14 [Source:HGNC Symbol;Acc:HGNC:29526]
88	R1	e019_R1	bundle of His cell-Purkinje myocyte adhesion involved in cell communication / Formation of the cornified envelope	REAC:R-HSA-6809371	NA	GO:0086073	GO:0007154;GO:0016043;GO:0065008;GO:0007155;GO:0050789	ENSG00000121060;ENSG00000060656;ENSG00000145242;ENSG00000096696;ENSG00000116106;ENSG00000079999;ENSG00000184304;ENSG00000046604;ENSG00000081277;ENSG00000179776;ENSG00000057294;ENSG00000100711;ENSG00000130348;ENSG00000257218;ENSG00000128011;ENSG00000031698;ENSG00000099617;ENSG00000173801;ENSG00000119522;ENSG00000135333;ENSG00000134760;ENSG00000080546;ENSG00000059691;ENSG00000134755;ENSG00000134765;ENSG00000134762;ENSG00000136830;ENSG00000178445;ENSG00000184363;ENSG00000256525	TRIM25;PTPRU;EPHA5;DSP;EPHA4;KEAP1;PRKD1;DSG2;PKP1;CDH5;PKP2;ZFYVE21;QRSL1;GATC;LRFN1;SARS1;EFNA2;JUP;DENND1A;EPHA7;DSG1;SESN1;GATB;DSC2;DSC1;DSC3;NIBAN2;GLDC;PKP3;POLG2	tripartite motif containing 25 [Source:HGNC Symbol;Acc:HGNC:12932] ~ protein tyrosine phosphatase receptor type U [Source:HGNC Symbol;Acc:HGNC:9683] ~ EPH receptor A5 [Source:HGNC Symbol;Acc:HGNC:3389] ~ desmoplakin [Source:HGNC Symbol;Acc:HGNC:3052] ~ EPH receptor A4 [Source:HGNC Symbol;Acc:HGNC:3388] ~ kelch like ECH associated protein 1 [Source:HGNC Symbol;Acc:HGNC:23177] ~ protein kinase D1 [Source:HGNC Symbol;Acc:HGNC:9407] ~ desmoglein 2 [Source:HGNC Symbol;Acc:HGNC:3049] ~ plakophilin 1 [Source:HGNC Symbol;Acc:HGNC:9023] ~ cadherin 5 [Source:HGNC Symbol;Acc:HGNC:1764] ~ plakophilin 2 [Source:HGNC Symbol;Acc:HGNC:9024] ~ zinc finger FYVE-type containing 21 [Source:HGNC Symbol;Acc:HGNC:20760] ~ glutaminyl-tRNA amidotransferase subunit QRSL1 [Source:HGNC Symbol;Acc:HGNC:21020] ~ glutamyl-tRNA amidotransferase subunit C [Source:HGNC Symbol;Acc:HGNC:25068] ~ leucine rich repeat and fibronectin type III domain containing 1 [Source:HGNC Symbol;Acc:HGNC:29290] ~ seryl-tRNA synthetase 1 [Source:HGNC Symbol;Acc:HGNC:10537] ~ ephrin A2 [Source:HGNC Symbol;Acc:HGNC:3222] ~ junction plakoglobin [Source:HGNC Symbol;Acc:HGNC:6207] ~ DENN domain containing 1A [Source:HGNC Symbol;Acc:HGNC:29324] ~ EPH receptor A7 [Source:HGNC Symbol;Acc:HGNC:3390] ~ desmoglein 1 [Source:HGNC Symbol;Acc:HGNC:3048] ~ sestrin 1 [Source:HGNC Symbol;Acc:HGNC:21595] ~ glutamyl-tRNA amidotransferase subunit B [Source:HGNC Symbol;Acc:HGNC:8849] ~ desmocollin 2 [Source:HGNC Symbol;Acc:HGNC:3036] ~ desmocollin 1 [Source:HGNC Symbol;Acc:HGNC:3035] ~ desmocollin 3 [Source:HGNC Symbol;Acc:HGNC:3037] ~ niban apoptosis regulator 2 [Source:HGNC Symbol;Acc:HGNC:25282] ~ glycine decarboxylase [Source:HGNC Symbol;Acc:HGNC:4313] ~ plakophilin 3 [Source:HGNC Symbol;Acc:HGNC:9025] ~ DNA polymerase gamma 2, accessory subunit [Source:HGNC Symbol;Acc:HGNC:9180]
89	R1	e019_R1	cyclooxygenase pathway	NA	NA	GO:0019371	GO:0044255;GO:0006082	ENSG00000125726;ENSG00000100201;ENSG00000141505;ENSG00000127445;ENSG00000136156;ENSG00000206503;ENSG00000139193;ENSG00000166130;ENSG00000115685;ENSG00000101892;ENSG00000114988;ENSG00000168077;ENSG00000132681;ENSG00000073756;ENSG00000095303;ENSG00000153936;ENSG00000155463;ENSG00000124212;ENSG00000142687;ENSG00000166788;ENSG00000160183;ENSG00000221968	CD70;DDX17;ASGR1;PIN1;ITM2B;HLA-A;CD27;IKBIP;PPP1R7;ATP1B4;LMAN2L;SCARA3;ATP1A4;PTGS2;PTGS1;HS2ST1;OXA1L;PTGIS;KIAA0319L;SAAL1;TMPRSS3;FADS3	CD70 molecule [Source:HGNC Symbol;Acc:HGNC:11937] ~ DEAD-box helicase 17 [Source:HGNC Symbol;Acc:HGNC:2740] ~ asialoglycoprotein receptor 1 [Source:HGNC Symbol;Acc:HGNC:742] ~ peptidylprolyl cis/trans isomerase, NIMA-interacting 1 [Source:HGNC Symbol;Acc:HGNC:8988] ~ integral membrane protein 2B [Source:HGNC Symbol;Acc:HGNC:6174] ~ major histocompatibility complex, class I, A [Source:HGNC Symbol;Acc:HGNC:4931] ~ CD27 molecule [Source:HGNC Symbol;Acc:HGNC:11922] ~ IKBKB interacting protein [Source:HGNC Symbol;Acc:HGNC:26430] ~ protein phosphatase 1 regulatory subunit 7 [Source:HGNC Symbol;Acc:HGNC:9295] ~ ATPase Na+/K+ transporting family member beta 4 [Source:HGNC Symbol;Acc:HGNC:808] ~ lectin, mannose binding 2 like [Source:HGNC Symbol;Acc:HGNC:19263] ~ scavenger receptor class A member 3 [Source:HGNC Symbol;Acc:HGNC:19000] ~ ATPase Na+/K+ transporting subunit alpha 4 [Source:HGNC Symbol;Acc:HGNC:14073] ~ prostaglandin-endoperoxide synthase 2 [Source:HGNC Symbol;Acc:HGNC:9605] ~ prostaglandin-endoperoxide synthase 1 [Source:HGNC Symbol;Acc:HGNC:9604] ~ heparan sulfate 2-O-sulfotransferase 1 [Source:HGNC Symbol;Acc:HGNC:5193] ~ OXA1L mitochondrial inner membrane protein [Source:HGNC Symbol;Acc:HGNC:8526] ~ prostaglandin I2 synthase [Source:HGNC Symbol;Acc:HGNC:9603] ~ KIAA0319 like [Source:HGNC Symbol;Acc:HGNC:30071] ~ serum amyloid A like 1 [Source:HGNC Symbol;Acc:HGNC:25158] ~ transmembrane serine protease 3 [Source:HGNC Symbol;Acc:HGNC:11877] ~ fatty acid desaturase 3 [Source:HGNC Symbol;Acc:HGNC:3576]
90	R1	e019_R1	cellular response to interleukin-15 / JAK-STAT signaling pathway / Interleukin-2 family signaling	REAC:R-HSA-451927	KEGG:04630	GO:0071350	GO:0050789;GO:0050896	ENSG00000131080;ENSG00000100385;ENSG00000124334;ENSG00000134470;ENSG00000135446;ENSG00000168685;ENSG00000147168;ENSG00000134460;ENSG00000145777;ENSG00000156738;ENSG00000090339;ENSG00000102468;ENSG00000131724;ENSG00000213694;ENSG00000178394;ENSG00000164136;ENSG00000135312;ENSG00000197471;ENSG00000088827;ENSG00000162769;ENSG00000145839;ENSG00000205755;ENSG00000250361;ENSG00000179546	EDA2R;IL2RB;IL9R;IL15RA;CDK4;IL7R;IL2RG;IL2RA;TSLP;MS4A1;ICAM1;HTR2A;IL13RA1;S1PR3;HTR1A;IL15;HTR1B;SPN;SIGLEC1;FLVCR1;IL9;CRLF2;GYPB;HTR1D	ectodysplasin A2 receptor [Source:HGNC Symbol;Acc:HGNC:17756] ~ interleukin 2 receptor subunit beta [Source:HGNC Symbol;Acc:HGNC:6009] ~ interleukin 9 receptor [Source:HGNC Symbol;Acc:HGNC:6030] ~ interleukin 15 receptor subunit alpha [Source:HGNC Symbol;Acc:HGNC:5978] ~ cyclin dependent kinase 4 [Source:HGNC Symbol;Acc:HGNC:1773] ~ interleukin 7 receptor [Source:HGNC Symbol;Acc:HGNC:6024] ~ interleukin 2 receptor subunit gamma [Source:HGNC Symbol;Acc:HGNC:6010] ~ interleukin 2 receptor subunit alpha [Source:HGNC Symbol;Acc:HGNC:6008] ~ thymic stromal lymphopoietin [Source:HGNC Symbol;Acc:HGNC:30743] ~ membrane spanning 4-domains A1 [Source:HGNC Symbol;Acc:HGNC:7315] ~ intercellular adhesion molecule 1 [Source:HGNC Symbol;Acc:HGNC:5344] ~ 5-hydroxytryptamine receptor 2A [Source:HGNC Symbol;Acc:HGNC:5293] ~ interleukin 13 receptor subunit alpha 1 [Source:HGNC Symbol;Acc:HGNC:5974] ~ sphingosine-1-phosphate receptor 3 [Source:HGNC Symbol;Acc:HGNC:3167] ~ 5-hydroxytryptamine receptor 1A [Source:HGNC Symbol;Acc:HGNC:5286] ~ interleukin 15 [Source:HGNC Symbol;Acc:HGNC:5977] ~ 5-hydroxytryptamine receptor 1B [Source:HGNC Symbol;Acc:HGNC:5287] ~ sialophorin [Source:HGNC Symbol;Acc:HGNC:11249] ~ sialic acid binding Ig like lectin 1 [Source:HGNC Symbol;Acc:HGNC:11127] ~ FLVCR heme transporter 1 [Source:HGNC Symbol;Acc:HGNC:24682] ~ interleukin 9 [Source:HGNC Symbol;Acc:HGNC:6029] ~ cytokine receptor like factor 2 [Source:HGNC Symbol;Acc:HGNC:14281] ~ glycophorin B (MNS blood group) [Source:HGNC Symbol;Acc:HGNC:4703] ~ 5-hydroxytryptamine receptor 1D [Source:HGNC Symbol;Acc:HGNC:5289]
