module	monet_type	experiment_info	function_summary	term_id_GO_BP	term_id_KEGG	term_id_REAC	goslim_pir	genes_orig	genes_hugo	genes_descriptions
1	R1	e019_R1	retrograde transport, endosome to Golgi / Endocytosis	GO:0042147	KEGG:04144	NA	GO:0051641;GO:0016192	ENSP00000000412;ENSP00000221957;ENSP00000230085;ENSP00000236671;ENSP00000260818;ENSP00000261889;ENSP00000281187;ENSP00000299138;ENSP00000310620;ENSP00000311399;ENSP00000311962;ENSP00000341344;ENSP00000349437;ENSP00000355217;ENSP00000357836;ENSP00000359540;ENSP00000362480;ENSP00000366998;ENSP00000368831;ENSP00000402935;ENSP00000438040;ENSP00000438085;ENSP00000445408;ENSP00000480853;ENSP00000481314	M6PR;PLIN3;SNX3;CTSD;DNAJC13;SNX1;VPS26B;VPS35;SNX32;VPS26C;GGA2;GGA1;IGF2R;SNX6;SNX27;CREG1;VPS26A;SNX5;SNX2;TBC1D5;CCDC91;GGA3;RABEP1;VPS29;SNX12	mannose-6-phosphate receptor, cation dependent [Source:HGNC Symbol;Acc:HGNC:6752] ~ perilipin 3 [Source:HGNC Symbol;Acc:HGNC:16893] ~ sorting nexin 3 [Source:HGNC Symbol;Acc:HGNC:11174] ~ cathepsin D [Source:HGNC Symbol;Acc:HGNC:2529] ~ DnaJ heat shock protein family (Hsp40) member C13 [Source:HGNC Symbol;Acc:HGNC:30343] ~ sorting nexin 1 [Source:HGNC Symbol;Acc:HGNC:11172] ~ VPS26 retromer complex component B [Source:HGNC Symbol;Acc:HGNC:28119] ~ VPS35 retromer complex component [Source:HGNC Symbol;Acc:HGNC:13487] ~ sorting nexin 32 [Source:HGNC Symbol;Acc:HGNC:26423] ~ VPS26 endosomal protein sorting factor C [Source:HGNC Symbol;Acc:HGNC:3044] ~ golgi associated, gamma adaptin ear containing, ARF binding protein 2 [Source:HGNC Symbol;Acc:HGNC:16064] ~ golgi associated, gamma adaptin ear containing, ARF binding protein 1 [Source:HGNC Symbol;Acc:HGNC:17842] ~ insulin like growth factor 2 receptor [Source:HGNC Symbol;Acc:HGNC:5467] ~ sorting nexin 6 [Source:HGNC Symbol;Acc:HGNC:14970] ~ sorting nexin 27 [Source:HGNC Symbol;Acc:HGNC:20073] ~ cellular repressor of E1A stimulated genes 1 [Source:HGNC Symbol;Acc:HGNC:2351] ~ VPS26 retromer complex component A [Source:HGNC Symbol;Acc:HGNC:12711] ~ sorting nexin 5 [Source:HGNC Symbol;Acc:HGNC:14969] ~ sorting nexin 2 [Source:HGNC Symbol;Acc:HGNC:11173] ~ TBC1 domain family member 5 [Source:HGNC Symbol;Acc:HGNC:19166] ~ coiled-coil domain containing 91 [Source:HGNC Symbol;Acc:HGNC:24855] ~ golgi associated, gamma adaptin ear containing, ARF binding protein 3 [Source:HGNC Symbol;Acc:HGNC:17079] ~ rabaptin, RAB GTPase binding effector protein 1 [Source:HGNC Symbol;Acc:HGNC:17677] ~ VPS29 retromer complex component [Source:HGNC Symbol;Acc:HGNC:14340] ~ sorting nexin 12 [Source:HGNC Symbol;Acc:HGNC:14976]
2	R1	e019_R1	mRNA export from nucleus / HSP90 chaperone cycle for steroid hormone receptors (SHR) in the presence of ligand	GO:0006406	NA	REAC:R-HSA-3371497	GO:0051641;GO:0009057;GO:0016070;GO:0015931;GO:0050789	ENSP00000001008;ENSP00000225577;ENSP00000231509;ENSP00000262719;ENSP00000263073;ENSP00000297494;ENSP00000321320;ENSP00000350815;ENSP00000355261;ENSP00000360329;ENSP00000362674;ENSP00000394051;ENSP00000397927;ENSP00000425133;ENSP00000444810;ENSP00000470034;ENSP00000470142;ENSP00000482075	FKBP4;RPS6KB1;NR3C1;PHLPP1;SMG6;NOS3;HGH1;NR3C2;SMG5;TTC4;HDAC8;NOSTRIN;POLDIP3;SMG7;FKBP5;NOSIP;UPF1;PTGES3	FKBP prolyl isomerase 4 [Source:HGNC Symbol;Acc:HGNC:3720] ~ ribosomal protein S6 kinase B1 [Source:HGNC Symbol;Acc:HGNC:10436] ~ nuclear receptor subfamily 3 group C member 1 [Source:HGNC Symbol;Acc:HGNC:7978] ~ PH domain and leucine rich repeat protein phosphatase 1 [Source:HGNC Symbol;Acc:HGNC:20610] ~ SMG6 nonsense mediated mRNA decay factor [Source:HGNC Symbol;Acc:HGNC:17809] ~ nitric oxide synthase 3 [Source:HGNC Symbol;Acc:HGNC:7876] ~ HGH1 homolog [Source:HGNC Symbol;Acc:HGNC:24161] ~ nuclear receptor subfamily 3 group C member 2 [Source:HGNC Symbol;Acc:HGNC:7979] ~ SMG5 nonsense mediated mRNA decay factor [Source:HGNC Symbol;Acc:HGNC:24644] ~ tetratricopeptide repeat domain 4 [Source:HGNC Symbol;Acc:HGNC:12394] ~ histone deacetylase 8 [Source:HGNC Symbol;Acc:HGNC:13315] ~ nitric oxide synthase trafficking [Source:HGNC Symbol;Acc:HGNC:20203] ~ DNA polymerase delta interacting protein 3 [Source:HGNC Symbol;Acc:HGNC:23782] ~ SMG7 nonsense mediated mRNA decay factor [Source:HGNC Symbol;Acc:HGNC:16792] ~ FKBP prolyl isomerase 5 [Source:HGNC Symbol;Acc:HGNC:3721] ~ nitric oxide synthase interacting protein [Source:HGNC Symbol;Acc:HGNC:17946] ~ UPF1 RNA helicase and ATPase [Source:HGNC Symbol;Acc:HGNC:9962] ~ prostaglandin E synthase 3 [Source:HGNC Symbol;Acc:HGNC:16049]
3	R1	e019_R1	regulation of endothelial cell proliferation / Ras signaling pathway / VEGF ligand-receptor interactions	GO:0001936	KEGG:04014	REAC:R-HSA-194313	GO:0032502;GO:0050789;GO:0040011;GO:0008283	ENSP00000002829;ENSP00000053867;ENSP00000216286;ENSP00000261937;ENSP00000263923;ENSP00000264036;ENSP00000264554;ENSP00000269886;ENSP00000282397;ENSP00000297904;ENSP00000311127;ENSP00000314897;ENSP00000320092;ENSP00000349022;ENSP00000352208;ENSP00000353582;ENSP00000358045;ENSP00000358696;ENSP00000361554;ENSP00000363827;ENSP00000366936;ENSP00000369375;ENSP00000369981;ENSP00000371347;ENSP00000371936;ENSP00000373905;ENSP00000442736;ENSP00000451040;ENSP00000478570;ENSP00000480043	SEMA3F;GRN;NID2;FLT4;KDR;MCAM;SHC2;SH3GL1;FLT1;VEGFD;VEGFB;ANGPT2;SH3GL3;ARC;MYOF;NRP2;ECM1;PLXNA3;TIE1;HSPG2;SHB;TEK;SH3GL2;ANGPT4;SEMA5A;DNM2;PLXNB3;PGF;None;VEGFC	semaphorin 3F [Source:HGNC Symbol;Acc:HGNC:10728] ~ granulin precursor [Source:HGNC Symbol;Acc:HGNC:4601] ~ nidogen 2 [Source:HGNC Symbol;Acc:HGNC:13389] ~ fms related receptor tyrosine kinase 4 [Source:HGNC Symbol;Acc:HGNC:3767] ~ kinase insert domain receptor [Source:HGNC Symbol;Acc:HGNC:6307] ~ melanoma cell adhesion molecule [Source:HGNC Symbol;Acc:HGNC:6934] ~ SHC adaptor protein 2 [Source:HGNC Symbol;Acc:HGNC:29869] ~ SH3 domain containing GRB2 like 1, endophilin A2 [Source:HGNC Symbol;Acc:HGNC:10830] ~ fms related receptor tyrosine kinase 1 [Source:HGNC Symbol;Acc:HGNC:3763] ~ vascular endothelial growth factor D [Source:HGNC Symbol;Acc:HGNC:3708] ~ vascular endothelial growth factor B [Source:HGNC Symbol;Acc:HGNC:12681] ~ angiopoietin 2 [Source:HGNC Symbol;Acc:HGNC:485] ~ SH3 domain containing GRB2 like 3, endophilin A3 [Source:HGNC Symbol;Acc:HGNC:10832] ~ activity regulated cytoskeleton associated protein [Source:HGNC Symbol;Acc:HGNC:648] ~ myoferlin [Source:HGNC Symbol;Acc:HGNC:3656] ~ neuropilin 2 [Source:HGNC Symbol;Acc:HGNC:8005] ~ extracellular matrix protein 1 [Source:HGNC Symbol;Acc:HGNC:3153] ~ plexin A3 [Source:HGNC Symbol;Acc:HGNC:9101] ~ tyrosine kinase with immunoglobulin like and EGF like domains 1 [Source:HGNC Symbol;Acc:HGNC:11809] ~ heparan sulfate proteoglycan 2 [Source:HGNC Symbol;Acc:HGNC:5273] ~ SH2 domain containing adaptor protein B [Source:HGNC Symbol;Acc:HGNC:10838] ~ TEK receptor tyrosine kinase [Source:HGNC Symbol;Acc:HGNC:11724] ~ SH3 domain containing GRB2 like 2, endophilin A1 [Source:HGNC Symbol;Acc:HGNC:10831] ~ angiopoietin 4 [Source:HGNC Symbol;Acc:HGNC:487] ~ semaphorin 5A [Source:HGNC Symbol;Acc:HGNC:10736] ~ dynamin 2 [Source:HGNC Symbol;Acc:HGNC:2974] ~ plexin B3 [Source:HGNC Symbol;Acc:HGNC:9105] ~ placental growth factor [Source:HGNC Symbol;Acc:HGNC:8893] ~ None ~ vascular endothelial growth factor C [Source:HGNC Symbol;Acc:HGNC:12682]
4	R1	e019_R1	regulation of intracellular pH	GO:0051453	NA	NA	GO:0050789;GO:0050896;GO:0065009	ENSP00000003084;ENSP00000261693;ENSP00000262613;ENSP00000263980;ENSP00000264938;ENSP00000289361;ENSP00000300113;ENSP00000301607;ENSP00000335632;ENSP00000340510;ENSP00000345873;ENSP00000348751;ENSP00000353408;ENSP00000356042;ENSP00000357484;ENSP00000364235;ENSP00000365198;ENSP00000366797;ENSP00000367817;ENSP00000378920;ENSP00000384136;ENSP00000384996;ENSP00000394485;ENSP00000408005	CFTR;SCARB1;SLC9A3R1;SLC9A1;SLC9A3;BTN3A1;CHP2;EVPL;CHP1;PPL;SLC26A3;BTN3A2;MSN;EZR;GOPC;RNF5;KAZN;SLC22A12;PODXL;SLC26A6;None;TBC1D10A;PDZK1;SLC9A3R2	CF transmembrane conductance regulator [Source:HGNC Symbol;Acc:HGNC:1884] ~ scavenger receptor class B member 1 [Source:HGNC Symbol;Acc:HGNC:1664] ~ SLC9A3 regulator 1 [Source:HGNC Symbol;Acc:HGNC:11075] ~ solute carrier family 9 member A1 [Source:HGNC Symbol;Acc:HGNC:11071] ~ solute carrier family 9 member A3 [Source:HGNC Symbol;Acc:HGNC:11073] ~ butyrophilin subfamily 3 member A1 [Source:HGNC Symbol;Acc:HGNC:1138] ~ calcineurin like EF-hand protein 2 [Source:HGNC Symbol;Acc:HGNC:24927] ~ envoplakin [Source:HGNC Symbol;Acc:HGNC:3503] ~ calcineurin like EF-hand protein 1 [Source:HGNC Symbol;Acc:HGNC:17433] ~ periplakin [Source:HGNC Symbol;Acc:HGNC:9273] ~ solute carrier family 26 member 3 [Source:HGNC Symbol;Acc:HGNC:3018] ~ butyrophilin subfamily 3 member A2 [Source:HGNC Symbol;Acc:HGNC:1139] ~ moesin [Source:HGNC Symbol;Acc:HGNC:7373] ~ ezrin [Source:HGNC Symbol;Acc:HGNC:12691] ~ golgi associated PDZ and coiled-coil motif containing [Source:HGNC Symbol;Acc:HGNC:17643] ~ ring finger protein 5 [Source:HGNC Symbol;Acc:HGNC:10068] ~ kazrin, periplakin interacting protein [Source:HGNC Symbol;Acc:HGNC:29173] ~ solute carrier family 22 member 12 [Source:HGNC Symbol;Acc:HGNC:17989] ~ podocalyxin like [Source:HGNC Symbol;Acc:HGNC:9171] ~ solute carrier family 26 member 6 [Source:HGNC Symbol;Acc:HGNC:14472] ~ None ~ TBC1 domain family member 10A [Source:HGNC Symbol;Acc:HGNC:23609] ~ PDZ domain containing 1 [Source:HGNC Symbol;Acc:HGNC:8821] ~ SLC9A3 regulator 2 [Source:HGNC Symbol;Acc:HGNC:11076]
5	R1	e019_R1	negative regulation of amyloid fibril formation / Prefoldin mediated transfer of substrate  to CCT/TriC	GO:1905907	NA	REAC:R-HSA-389957	GO:0050789;GO:0019538;GO:0016043	ENSP00000003302;ENSP00000244573;ENSP00000261813;ENSP00000264709;ENSP00000271715;ENSP00000286428;ENSP00000295746;ENSP00000325618;ENSP00000330074;ENSP00000350869;ENSP00000351490;ENSP00000355245;ENSP00000356234;ENSP00000356989;ENSP00000359357;ENSP00000360473;ENSP00000364885;ENSP00000370109;ENSP00000372170;ENSP00000378563;ENSP00000383986;ENSP00000447942;ENSP00000479618	USP28;H1-1;PFDN1;DNMT3A;POGZ;VBP1;CIP2A;PARP10;H1-5;ZNF346;MAX;PAX9;KDM5B;PFDN2;GFI1;PFDN4;ZBTB17;PSIP1;MSX1;PFDN6;CDCA7L;PFDN5;None	ubiquitin specific peptidase 28 [Source:HGNC Symbol;Acc:HGNC:12625] ~ H1.1 linker histone, cluster member [Source:HGNC Symbol;Acc:HGNC:4715] ~ prefoldin subunit 1 [Source:HGNC Symbol;Acc:HGNC:8866] ~ DNA methyltransferase 3 alpha [Source:HGNC Symbol;Acc:HGNC:2978] ~ pogo transposable element derived with ZNF domain [Source:HGNC Symbol;Acc:HGNC:18801] ~ VHL binding protein 1 [Source:HGNC Symbol;Acc:HGNC:12662] ~ cellular inhibitor of PP2A [Source:HGNC Symbol;Acc:HGNC:29302] ~ poly(ADP-ribose) polymerase family member 10 [Source:HGNC Symbol;Acc:HGNC:25895] ~ H1.5 linker histone, cluster member [Source:HGNC Symbol;Acc:HGNC:4719] ~ zinc finger protein 346 [Source:HGNC Symbol;Acc:HGNC:16403] ~ MYC associated factor X [Source:HGNC Symbol;Acc:HGNC:6913] ~ paired box 9 [Source:HGNC Symbol;Acc:HGNC:8623] ~ lysine demethylase 5B [Source:HGNC Symbol;Acc:HGNC:18039] ~ prefoldin subunit 2 [Source:HGNC Symbol;Acc:HGNC:8867] ~ growth factor independent 1 transcriptional repressor [Source:HGNC Symbol;Acc:HGNC:4237] ~ prefoldin subunit 4 [Source:HGNC Symbol;Acc:HGNC:8868] ~ zinc finger and BTB domain containing 17 [Source:HGNC Symbol;Acc:HGNC:12936] ~ PC4 and SFRS1 interacting protein 1 [Source:HGNC Symbol;Acc:HGNC:9527] ~ msh homeobox 1 [Source:HGNC Symbol;Acc:HGNC:7391] ~ prefoldin subunit 6 [Source:HGNC Symbol;Acc:HGNC:4926] ~ cell division cycle associated 7 like [Source:HGNC Symbol;Acc:HGNC:30777] ~ prefoldin subunit 5 [Source:HGNC Symbol;Acc:HGNC:8869] ~ None
6	R1	e019_R1	sensory perception of sound / Sensory processing of sound by outer hair cells of the cochlea	GO:0007605	NA	REAC:R-HSA-9662361	GO:0032502;GO:0050877	ENSP00000005226;ENSP00000205890;ENSP00000225525;ENSP00000297784;ENSP00000305941;ENSP00000308772;ENSP00000324775;ENSP00000330633;ENSP00000353346;ENSP00000354623;ENSP00000363068;ENSP00000381768;ENSP00000384582;ENSP00000386331;ENSP00000393128;ENSP00000410083;ENSP00000415090;ENSP00000480279;ENSP00000480489	USH1C;None;TAX1BP3;TMC1;USH2A;ANKS4B;CNTN2;LHFPL5;WHRN;PCDH15;CDH23;ADGRV1;MYO7A;LHFPL3;VEZT;MYO7B;USH1G;PDZD7	USH1 protein network component harmonin [Source:HGNC Symbol;Acc:HGNC:12597] ~ None ~ Tax1 binding protein 3 [Source:HGNC Symbol;Acc:HGNC:30684] ~ transmembrane channel like 1 [Source:HGNC Symbol;Acc:HGNC:16513] ~ usherin [Source:HGNC Symbol;Acc:HGNC:12601] ~ ankyrin repeat and sterile alpha motif domain containing 4B [Source:HGNC Symbol;Acc:HGNC:26795] ~ contactin 2 [Source:HGNC Symbol;Acc:HGNC:2172] ~ LHFPL tetraspan subfamily member 5 [Source:HGNC Symbol;Acc:HGNC:21253] ~ whirlin [Source:HGNC Symbol;Acc:HGNC:16361] ~ protocadherin related 15 [Source:HGNC Symbol;Acc:HGNC:14674] ~ cadherin related 23 [Source:HGNC Symbol;Acc:HGNC:13733] ~ adhesion G protein-coupled receptor V1 [Source:HGNC Symbol;Acc:HGNC:17416] ~ myosin VIIA [Source:HGNC Symbol;Acc:HGNC:7606] ~ LHFPL tetraspan subfamily member 3 [Source:HGNC Symbol;Acc:HGNC:6589] ~ vezatin, adherens junctions transmembrane protein [Source:HGNC Symbol;Acc:HGNC:18258] ~ myosin VIIB [Source:HGNC Symbol;Acc:HGNC:7607] ~ USH1 protein network component sans [Source:HGNC Symbol;Acc:HGNC:16356] ~ PDZ domain containing 7 [Source:HGNC Symbol;Acc:HGNC:26257]
7	R1	e019_R1	vesicle tethering involved in exocytosis / VxPx cargo-targeting to cilium	GO:0090522	NA	REAC:R-HSA-5620916	GO:0046903;GO:0061024;GO:0051640;GO:0016192;GO:0022406	ENSP00000005257;ENSP00000019317;ENSP00000216106;ENSP00000219782;ENSP00000230449;ENSP00000238738;ENSP00000253861;ENSP00000260762;ENSP00000272427;ENSP00000272519;ENSP00000307208;ENSP00000320117;ENSP00000325674;ENSP00000333920;ENSP00000334100;ENSP00000341219;ENSP00000349824;ENSP00000353458;ENSP00000355605;ENSP00000360162;ENSP00000369409;ENSP00000370695;ENSP00000387498;ENSP00000400713;ENSP00000425587;ENSP00000446880;ENSP00000448598;ENSP00000452634;ENSP00000484855	RALA;RALBP1;HMGXB4;MAZ;EXOC2;RHOQ;EXOC4;EXOC6;EXOC6B;RALB;BPTF;TRIP10;EXOC3L1;TTF1;EXOC7;CECR2;REPS2;BAZ1A;EXOC8;SMARCA1;EXOC3L4;EXOC1;FUT2;EXOC3L2;EXOC3;BAZ2A;C17orf49;TNFAIP2;EXOC5	RAS like proto-oncogene A [Source:HGNC Symbol;Acc:HGNC:9839] ~ ralA binding protein 1 [Source:HGNC Symbol;Acc:HGNC:9841] ~ HMG-box containing 4 [Source:HGNC Symbol;Acc:HGNC:5003] ~ MYC associated zinc finger protein [Source:HGNC Symbol;Acc:HGNC:6914] ~ exocyst complex component 2 [Source:HGNC Symbol;Acc:HGNC:24968] ~ ras homolog family member Q [Source:HGNC Symbol;Acc:HGNC:17736] ~ exocyst complex component 4 [Source:HGNC Symbol;Acc:HGNC:30389] ~ exocyst complex component 6 [Source:HGNC Symbol;Acc:HGNC:23196] ~ exocyst complex component 6B [Source:HGNC Symbol;Acc:HGNC:17085] ~ RAS like proto-oncogene B [Source:HGNC Symbol;Acc:HGNC:9840] ~ bromodomain PHD finger transcription factor [Source:HGNC Symbol;Acc:HGNC:3581] ~ thyroid hormone receptor interactor 10 [Source:HGNC Symbol;Acc:HGNC:12304] ~ exocyst complex component 3 like 1 [Source:HGNC Symbol;Acc:HGNC:27540] ~ transcription termination factor 1 [Source:HGNC Symbol;Acc:HGNC:12397] ~ exocyst complex component 7 [Source:HGNC Symbol;Acc:HGNC:23214] ~ CECR2 histone acetyl-lysine reader [Source:HGNC Symbol;Acc:HGNC:1840] ~ RALBP1 associated Eps domain containing 2 [Source:HGNC Symbol;Acc:HGNC:9963] ~ bromodomain adjacent to zinc finger domain 1A [Source:HGNC Symbol;Acc:HGNC:960] ~ exocyst complex component 8 [Source:HGNC Symbol;Acc:HGNC:24659] ~ SWI/SNF related, matrix associated, actin dependent regulator of chromatin, subfamily a, member 1 [Source:HGNC Symbol;Acc:HGNC:11097] ~ exocyst complex component 3 like 4 [Source:HGNC Symbol;Acc:HGNC:20120] ~ exocyst complex component 1 [Source:HGNC Symbol;Acc:HGNC:30380] ~ fucosyltransferase 2 [Source:HGNC Symbol;Acc:HGNC:4013] ~ exocyst complex component 3 like 2 [Source:HGNC Symbol;Acc:HGNC:30162] ~ exocyst complex component 3 [Source:HGNC Symbol;Acc:HGNC:30378] ~ bromodomain adjacent to zinc finger domain 2A [Source:HGNC Symbol;Acc:HGNC:962] ~ chromosome 17 open reading frame 49 [Source:HGNC Symbol;Acc:HGNC:28737] ~ TNF alpha induced protein 2 [Source:HGNC Symbol;Acc:HGNC:11895] ~ exocyst complex component 5 [Source:HGNC Symbol;Acc:HGNC:10696]
8	R1	e019_R1	actin filament-based process / Yersinia infection / RHO GTPases Activate WASPs and WAVEs	GO:0030029	KEGG:05135	REAC:R-HSA-5663213	GO:0006996	ENSP00000005260;ENSP00000219596;ENSP00000223023;ENSP00000228825;ENSP00000242140;ENSP00000248594;ENSP00000252071;ENSP00000256001;ENSP00000262942;ENSP00000263238;ENSP00000263246;ENSP00000294129;ENSP00000294742;ENSP00000295685;ENSP00000320924;ENSP00000345361;ENSP00000365891;ENSP00000367220;ENSP00000376024;ENSP00000380427;ENSP00000388169;ENSP00000389631;ENSP00000394496;ENSP00000413625;ENSP00000440945;ENSP00000452746;ENSP00000484060	BAIAP2L1;MEFV;WASL;ARPC3;WIPF3;PTPN12;ACTR3C;ACTR3B;ARPC1A;ACTR3;PACSIN2;NCKIPSD;ARPC5;ARPC2;WIPF2;ARPC5L;WAS;ACTR2;SNX9;ARPC4-TTLL3;ARPC4;ARPC1B;CORO1C;FNBP1;PACSIN3;PSTPIP1;PACSIN1	BAR/IMD domain containing adaptor protein 2 like 1 [Source:HGNC Symbol;Acc:HGNC:21649] ~ MEFV innate immuity regulator, pyrin [Source:HGNC Symbol;Acc:HGNC:6998] ~ WASP like actin nucleation promoting factor [Source:HGNC Symbol;Acc:HGNC:12735] ~ actin related protein 2/3 complex subunit 3 [Source:HGNC Symbol;Acc:HGNC:706] ~ WAS/WASL interacting protein family member 3 [Source:HGNC Symbol;Acc:HGNC:22004] ~ protein tyrosine phosphatase non-receptor type 12 [Source:HGNC Symbol;Acc:HGNC:9645] ~ actin related protein 3C [Source:HGNC Symbol;Acc:HGNC:37282] ~ actin related protein 3B [Source:HGNC Symbol;Acc:HGNC:17256] ~ actin related protein 2/3 complex subunit 1A [Source:HGNC Symbol;Acc:HGNC:703] ~ actin related protein 3 [Source:HGNC Symbol;Acc:HGNC:170] ~ protein kinase C and casein kinase substrate in neurons 2 [Source:HGNC Symbol;Acc:HGNC:8571] ~ NCK interacting protein with SH3 domain [Source:HGNC Symbol;Acc:HGNC:15486] ~ actin related protein 2/3 complex subunit 5 [Source:HGNC Symbol;Acc:HGNC:708] ~ actin related protein 2/3 complex subunit 2 [Source:HGNC Symbol;Acc:HGNC:705] ~ WAS/WASL interacting protein family member 2 [Source:HGNC Symbol;Acc:HGNC:30923] ~ actin related protein 2/3 complex subunit 5 like [Source:HGNC Symbol;Acc:HGNC:23366] ~ WASP actin nucleation promoting factor [Source:HGNC Symbol;Acc:HGNC:12731] ~ actin related protein 2 [Source:HGNC Symbol;Acc:HGNC:169] ~ sorting nexin 9 [Source:HGNC Symbol;Acc:HGNC:14973] ~ ARPC4-TTLL3 readthrough [Source:HGNC Symbol;Acc:HGNC:38830] ~ actin related protein 2/3 complex subunit 4 [Source:HGNC Symbol;Acc:HGNC:707] ~ actin related protein 2/3 complex subunit 1B [Source:HGNC Symbol;Acc:HGNC:704] ~ coronin 1C [Source:HGNC Symbol;Acc:HGNC:2254] ~ formin binding protein 1 [Source:HGNC Symbol;Acc:HGNC:17069] ~ protein kinase C and casein kinase substrate in neurons 3 [Source:HGNC Symbol;Acc:HGNC:8572] ~ proline-serine-threonine phosphatase interacting protein 1 [Source:HGNC Symbol;Acc:HGNC:9580] ~ protein kinase C and casein kinase substrate in neurons 1 [Source:HGNC Symbol;Acc:HGNC:8570]
9	R1	e019_R1	regulation of monoatomic ion transmembrane transporter activity / Arrhythmogenic right ventricular cardiomyopathy / Presynaptic depolarization and calcium channel opening	GO:0032412	KEGG:05412	REAC:R-HSA-112308	GO:0006811;GO:0015031;GO:0016192;GO:0007154;GO:0050789;GO:0065009	ENSP00000005284;ENSP00000219197;ENSP00000226021;ENSP00000252729;ENSP00000262138;ENSP00000264833;ENSP00000266376;ENSP00000270458;ENSP00000272133;ENSP00000282020;ENSP00000282499;ENSP00000288139;ENSP00000296526;ENSP00000300105;ENSP00000301050;ENSP00000310003;ENSP00000320025;ENSP00000327509;ENSP00000329200;ENSP00000349320;ENSP00000355192;ENSP00000365441;ENSP00000372169;ENSP00000375647;ENSP00000377840;ENSP00000397351;ENSP00000418081;ENSP00000419101;ENSP00000428994;ENSP00000438949;ENSP00000454014;ENSP00000481554	CACNG3;CBLN1;CACNG1;CACNG6;CACNG4;OLFM2;CACNA1C;CACNG8;CNIH3;GRID2;GRIA4;CACNA1D;GRIA2;CACNG2;CACNB3;CNIH2;CACNB2;STAC2;STAC3;CACNA2D1;CACNA1S;CACNA1F;CACNA2D4;CACNG7;CACNB1;GRID2IP;CACNA2D2;CACNA2D3;GRIA1;CACNB4;SHISA9;GRIA3	calcium voltage-gated channel auxiliary subunit gamma 3 [Source:HGNC Symbol;Acc:HGNC:1407] ~ cerebellin 1 precursor [Source:HGNC Symbol;Acc:HGNC:1543] ~ calcium voltage-gated channel auxiliary subunit gamma 1 [Source:HGNC Symbol;Acc:HGNC:1405] ~ calcium voltage-gated channel auxiliary subunit gamma 6 [Source:HGNC Symbol;Acc:HGNC:13625] ~ calcium voltage-gated channel auxiliary subunit gamma 4 [Source:HGNC Symbol;Acc:HGNC:1408] ~ olfactomedin 2 [Source:HGNC Symbol;Acc:HGNC:17189] ~ calcium voltage-gated channel subunit alpha1 C [Source:HGNC Symbol;Acc:HGNC:1390] ~ calcium voltage-gated channel auxiliary subunit gamma 8 [Source:HGNC Symbol;Acc:HGNC:13628] ~ cornichon family AMPA receptor auxiliary protein 3 [Source:HGNC Symbol;Acc:HGNC:26802] ~ glutamate ionotropic receptor delta type subunit 2 [Source:HGNC Symbol;Acc:HGNC:4576] ~ glutamate ionotropic receptor AMPA type subunit 4 [Source:HGNC Symbol;Acc:HGNC:4574] ~ calcium voltage-gated channel subunit alpha1 D [Source:HGNC Symbol;Acc:HGNC:1391] ~ glutamate ionotropic receptor AMPA type subunit 2 [Source:HGNC Symbol;Acc:HGNC:4572] ~ calcium voltage-gated channel auxiliary subunit gamma 2 [Source:HGNC Symbol;Acc:HGNC:1406] ~ calcium voltage-gated channel auxiliary subunit beta 3 [Source:HGNC Symbol;Acc:HGNC:1403] ~ cornichon family AMPA receptor auxiliary protein 2 [Source:HGNC Symbol;Acc:HGNC:28744] ~ calcium voltage-gated channel auxiliary subunit beta 2 [Source:HGNC Symbol;Acc:HGNC:1402] ~ SH3 and cysteine rich domain 2 [Source:HGNC Symbol;Acc:HGNC:23990] ~ SH3 and cysteine rich domain 3 [Source:HGNC Symbol;Acc:HGNC:28423] ~ calcium voltage-gated channel auxiliary subunit alpha2delta 1 [Source:HGNC Symbol;Acc:HGNC:1399] ~ calcium voltage-gated channel subunit alpha1 S [Source:HGNC Symbol;Acc:HGNC:1397] ~ calcium voltage-gated channel subunit alpha1 F [Source:HGNC Symbol;Acc:HGNC:1393] ~ calcium voltage-gated channel auxiliary subunit alpha2delta 4 [Source:HGNC Symbol;Acc:HGNC:20202] ~ calcium voltage-gated channel auxiliary subunit gamma 7 [Source:HGNC Symbol;Acc:HGNC:13626] ~ calcium voltage-gated channel auxiliary subunit beta 1 [Source:HGNC Symbol;Acc:HGNC:1401] ~ Grid2 interacting protein [Source:HGNC Symbol;Acc:HGNC:18464] ~ calcium voltage-gated channel auxiliary subunit alpha2delta 2 [Source:HGNC Symbol;Acc:HGNC:1400] ~ calcium voltage-gated channel auxiliary subunit alpha2delta 3 [Source:HGNC Symbol;Acc:HGNC:15460] ~ glutamate ionotropic receptor AMPA type subunit 1 [Source:HGNC Symbol;Acc:HGNC:4571] ~ calcium voltage-gated channel auxiliary subunit beta 4 [Source:HGNC Symbol;Acc:HGNC:1404] ~ shisa family member 9 [Source:HGNC Symbol;Acc:HGNC:37231] ~ glutamate ionotropic receptor AMPA type subunit 3 [Source:HGNC Symbol;Acc:HGNC:4573]
10	R1	e019_R1	Wnt signaling pathway, planar cell polarity pathway / Basal cell carcinoma / PCP/CE pathway	GO:0060071	KEGG:05217	REAC:R-HSA-4086400	GO:0032502;GO:0050789;GO:0007154	ENSP00000005340;ENSP00000262457;ENSP00000264634;ENSP00000285018;ENSP00000286201;ENSP00000290167;ENSP00000296849;ENSP00000316054;ENSP00000323901;ENSP00000325526;ENSP00000330523;ENSP00000337439;ENSP00000337443;ENSP00000351605;ENSP00000354607;ENSP00000364860;ENSP00000368169;ENSP00000378557;ENSP00000379228	DVL2;INVS;WNT5A;WNT7A;FZD7;WNT4;NKD2;DVL3;FZD2;WNT11;CTHRC1;DACT1;NXN;FZD6;FZD5;ROR2;DVL1;DAAM1;HECW1	dishevelled segment polarity protein 2 [Source:HGNC Symbol;Acc:HGNC:3086] ~ inversin [Source:HGNC Symbol;Acc:HGNC:17870] ~ Wnt family member 5A [Source:HGNC Symbol;Acc:HGNC:12784] ~ Wnt family member 7A [Source:HGNC Symbol;Acc:HGNC:12786] ~ frizzled class receptor 7 [Source:HGNC Symbol;Acc:HGNC:4045] ~ Wnt family member 4 [Source:HGNC Symbol;Acc:HGNC:12783] ~ NKD inhibitor of WNT signaling pathway 2 [Source:HGNC Symbol;Acc:HGNC:17046] ~ dishevelled segment polarity protein 3 [Source:HGNC Symbol;Acc:HGNC:3087] ~ frizzled class receptor 2 [Source:HGNC Symbol;Acc:HGNC:4040] ~ Wnt family member 11 [Source:HGNC Symbol;Acc:HGNC:12776] ~ collagen triple helix repeat containing 1 [Source:HGNC Symbol;Acc:HGNC:18831] ~ dishevelled binding antagonist of beta catenin 1 [Source:HGNC Symbol;Acc:HGNC:17748] ~ nucleoredoxin [Source:HGNC Symbol;Acc:HGNC:18008] ~ frizzled class receptor 6 [Source:HGNC Symbol;Acc:HGNC:4044] ~ frizzled class receptor 5 [Source:HGNC Symbol;Acc:HGNC:4043] ~ receptor tyrosine kinase like orphan receptor 2 [Source:HGNC Symbol;Acc:HGNC:10257] ~ dishevelled segment polarity protein 1 [Source:HGNC Symbol;Acc:HGNC:3084] ~ dishevelled associated activator of morphogenesis 1 [Source:HGNC Symbol;Acc:HGNC:18142] ~ HECT, C2 and WW domain containing E3 ubiquitin protein ligase 1 [Source:HGNC Symbol;Acc:HGNC:22195]
